name,preco,avaliacao
Tv Smart LG Led 32 32lq620 Hd Wifi Bt Hdr Thinqai 100v/240v,1.999,(5)
Samsung Galaxy A03 Dual SIM 64 GB preto 4 GB RAM,1.299,(1344)
Kit Cftv 4 Câmeras Multi Hd 720p 1mp Dvr Intelbras Mhdx 1104,1.159,(415)
Samsung Galaxy M23 5G 128 GB light blue 6 GB RAM,1.999,(272)
Kit 2x Whey Protein + 2x Bcaa + 2x Creatina + Coqueteleira,199,(2184)
Moto G20 Dual SIM 64 GB grafite 4 GB RAM,1.209,(2988)
Fone De Ouvido Bluetooth Redmi Air2dots Xiaomi 100% Original,159,(150)
Parafusadeira Furadeira 12v Bivolt Pfe-12ev Maleta Kit Evald,208,(730)
"Smart TV Samsung UN32T4300AGXZD LED HD 32""",2.299,(928)
Câmera 3 Antenas Ip Onvif Wifi Wireless Robô Visão Noturna,163,(461)
TCL 103 Dual SIM 64 GB power grey 2 GB RAM,1.099,(635)
Kit 2 Mesa De Cabeceira Retrô  Dream Off White/freijo,378,(270)
"Smart TV LG AI ThinQ 50UP751C0SF LED 4K 50"" 100V/240V",3.499,(9)
Lavadora De Alta Pressão Abw-vbr-70p 1400w Klatter 220v,339,(350)
Fritadeira Sem Óleo Mondial Af-30i Air Fryer 3.5l Preta 110v,469,
"Pc Computador Cpu Intel Core I5 + Ssd 240gb, 8gb Memória Ram",1.829,(362)
Arandela Slim Interna Externa Alumínio 2 Friso Moderna,23,(339)
"Kit C/ 9 Toalha De Banho Gigante 80 X 1,50 Atacado + Brinde",214,(2167)
"Kit 5 Luminária Tubular Led Slim 1,2mt Branco Frio 120cm 40w",169,(376)
"Torquimetro Estalo Mini P/ Soquete 1/4 5-25 Nm 0,5kg A 2,5kg",185,(164)
Kit 6 Radios Comunicador Baofeng 777s Profissional Ht Uhf,396,(8287)
Estabilizador Gimbal Dji Osmo Mobile 4 Se Combo,1.499,(569)
Bicicleta Alumínio Aro 29 Gts 21 Vel Freio A Disco Ride 19,1.249,(1058)
10x Farol De Milha 14 Led 42w 12v/24v Redondo Off-road 6000k,215,(134)
"Kit 4 Banquetas Alta, Bistro Direto Da Fabrica, Promoção -sd",369,(5345)
Guarda Roupa Dobrável Organizador Roupa Melhor Preço Loi,227,(986)
Kit 2 Câmeras De Segurança Ip Wifi A Prova D'água Com Cartão,600,(8)
Kit 2 Cadeiras Tulipa Com Base De Madeira Begônia,399,(208)
Notebook Ideapad 3 15.6'' Ryzen 7 8gb 256gb Ssd W11 Lenovo,4.599,(34)
Jogo Kit De Soquete 57 Peças 1/4 Catraca Chave Allen Stels,189,(272)
"Smart TV LG AI ThinQ 43UP751C0SF LED 4K 43"" 100V/240V",2.799,(16)
Fita Adesiva Transparente 45mm X 100 Metros - 10 Unidades,75,(624)
Samsung Galaxy A03 Dual SIM 64 GB vermelho 4 GB RAM,1.299,(1344)
Edredom Sherpa Cobertor E Coberdrom Casal Queen Grosso Cores,199,(290)
Tênis Masculino Duramo Sl 2.0 adidas,399,(7)
Barbeador y cortador de cabelo Mondial Super Grooming BG-03  preto e azul 110V/220V,155,(9033)
Câmera de segurança Haiz HZ-A8 com resolução de 2MP visão nocturna incluída branca,200,(1172)
Maquininha Point Smart - A Máquina De Cartão Do Mercado Pago,225,(607)
Bolsa De Ombro Samsonite Move 3.0 Preta,420,
Creatina Dual Power Glicina Coq10 + Maltodextrina Bodyaction,53,(117)
Kit Gamer Teclado Iluminado Com Mouse Fone E Mousepad Tedge,229,(118)
Mesa Lateral Redonda Industrial 50 Cm Begônia,199,(21)
Pc Fácil Intel Pentium G6400 10ª Geração 8gb Ddr4 Ssd 240gb,1.749,(6)
Sapato Salto Bloco Pelica Vizzano,139,
Placa de vídeo Nvidia Galax  GeForce GTX 16 Series GTX 1660 60SRH7DSY91C 6GB,2.699,(74)
Kit 6 Radio Walk Talk Comunicador 16 Ch 12km Baofeng 777s Ht,399,(8287)
Luminaria Pixar Articulada Abajur De Mesa Garra E Base,145,(365)
TCL 103 Dual SIM 32 GB power grey 2 GB RAM,999,(635)
Refletor Led 200w Holofote Bivolt Branco Frio Prova D Agua Luz Smd Lampada Luminaria Led Iluminação Placa Super Led Novo,123,(238)
Moto E40 Dual SIM 64 GB grafite 4 GB RAM,1.499,(199)
Pc Gamer Completoamd A8 16gb | Ssd | R7 Series + Jogos,3.332,
Coturno Tratorado Bota Feminina Salto Médio Grosso Conforto,78,(115)
"Monitor gamer LG 29UM69G led 29 "" preto 100V/240V",2.159,(380)
Moto G60 Dual SIM 128 GB prata 4 GB RAM,2.059,(1504)
Kit 2 Poltronas Decorativas Tilla Consultorio Recepção Sala,389,(45)
Capa Para Moto Forrada Impermeável Térmica Sol Chuva Lom,102,(2281)
Cadeira de escritório Tedge 435878 gamer ergonômica  preta e azul com estofado de couro sintético,649,(157)
"Smart TV LG AI ThinQ 55UP751C0SF LCD 4K 55"" 100V/240V",3.399,(81)
Carrinho Auxiliar Organizador Multiuso Salão Beleza 4 Gaveta,399,(153)
Tênis Masculino Proof 3 Olympikus,199,(510)
Nokia Cseries C20 Dual SIM 32 GB azul 2 GB RAM,629,(452)
Scanner Autocom Delphi Cdp 2022 + 8 Cabos Linha Leve + Af,797,(4)
"Notebook Lenovo IdeaPad 15IML05  platinum gray 15.6"", Intel Core i3 10110U  4GB de RAM 256GB SSD, Intel UHD Graphics 620 1366x768px Windows 11 Home",3.399,(422)
Kit 3 Calça Feminina Plus Size Atacado Com Bastante Lycra,199,(277)
Tenda Gazebo Sol Praia Barraca 3x3 Sanfonada Articulada,729,(357)
"Smart TV LG 32LQ621CBSB .AWZ LED HD 32"" 100V/240V",1.499,(12)
Kit Com 10 Cuecas Boxer Masculina Microfibra Original,139,(481)
Samsung Galaxy A71 Dual SIM 128 GB azul 6 GB RAM,3.499,(1817)
Kit 2 Refletor Led 100w Holofote Bivolt Prova Dágua Luz Frio,116,(1599)
Estação De Musculação Academia Podiumfit Me100 - 50kg,3.190,
No break Ts Shara Compact XPro Universal 1400 1400VA entrada e saída de 115V/220V CA preto,679,(215)
Esmerilhadeira 4.1/2 9002 + 3 D Skil Garantia 2 Anos Bosch,274,(5938)
Webcam Gamer Full Hd 1080p Foco Manual Tripé Tedge,99,(51)
Pneu dianteira para moto Michelin Sport Touring Road 5 para uso sem câmara 120/70 ZR17 W 58,889,(104)
Impressora a cor multifuncional Epson EcoTank L3250 com wifi preta 100V/240V,1.699,(2708)
Par Super Led Mini 20000lumens H1 H3 H7 H4 H11 Hb4 Hb3 6500k,75,(185)
Smartphone Motorola Moto G60 128gb Câmera Tripla Preto,2.059,(1504)
Pneu Itaro IT301 P 265/50R20 111 V,755,
LG K22 Dual SIM 32 GB titan 2 GB RAM,999,(2981)
Samsung Galaxy A03 Dual SIM 64 GB azul 4 GB RAM,1.299,(1344)
Copo Cerveja Tulipa 300ml - Kit 12 Unidades,195,
Folha / Lâmina De Madeira Freijó Composta Com Nós E Veios,140,
Máquina de solda inverter Klatter KL70540 preta e verde 220V,399,(112)
"Smart TV LG AI ThinQ 55UP7750PSB LED 4K 55"" 100V/240V",4.742,(207)
Geladeira frost free Brastemp BRM44H inox com freezer 375L 220V,3.860,(595)
Porta Acetona Com Dosador Para Manicure E Pedicure 180 Ml,23,
Dosador De Detergente Em Aço Inox Pingoo.casa,99,(4)
Passadeira a vapor Cadence Lisser 127V - VAP901,149,(508)
Jogo De Broca P/ Construcao 4 A 8mm 2 607 018 285 Bosch Ref,106,(38)
Pneu Itaro IT203 P 195/55R16 91 V,332,(27)
Formão Chanfrado Emborrachado 1/4'' 6mm 245019 Mtx,29,
Amaciante Amacitel Super Brise em frasco 500 ml,11,
Camiseta Estampada Gola V Patch R Reserva,189,
Serra Circular De Widea 185mm X 40d D-51356 - Makita,62,
Cafeteira Cadence Trends Neo mint CAF209 semi automática neo mint de filtro 127V,189,(8)
Kit Espátula Plástica Cera Depilação Aplicar Coloração Com 6,29,
Calça Masculina Over Jeans Médio Polo Wear,119,
Prateleira De Madeira Com Suporte Branco 60x18cm Begônia,139,
Sapato Salto Bloco Pelica Vizzano,129,
Tira manchas Ecomax Roupas Brancas em pó pote 450 g,27,
Espatula Palito Inox P/ Cuticula Manicure Pedicure Unhas,20,
Tênis Feminino Solado Plataforma Bebecê,189,
Moletom Menino Malha Estampado Wondrus,75,
Tenis Vizzano Casual Pelica 1389-101,149,
"Arame Auto-protegido 0,8 Mm 1kg P/ Solda Mig Sem Uso De Gás",68,(104)
Manta Asfáltica Auto Adesiva Aluminizada - 60cm X 10m,178,
"Papel De Parede Geométrico Cubos Bege 9,5mx52cm Begônia",80,
Kit Prendedor Cabelo Plástico Clip Piranha Cabelereiro C/6,10,
Descanso De Panela Margarida Preto E Natural - C De Casa,13,
Cola Unha Postiça Dompel Original Profissional Acrilicas 5g,14,
Pente De Carbono Antiestático Com Cabo Fino Separador Mechas,19,
Kit Unhas Postiças Natural Quadrada Média Alongamento C/ 48,19,
Chinelo Kids Básico Coleção Times Flamengo Neorubber,49,
Xícara De Café Mudra 110 Ml - Home Style,35,
Escova Profissional Termica 33mm Cerdas Dupla Altura 180ºc,119,
Sika Concreto Forte - 1 L,24,
Escova Mágica De Desembaraçar Pentear Cabelo Profissional,19,
Travesseiro Toque De Pluma Percal 50x70 Mercado Livre Basics,59,(6)
"Suporte Connect Antenas Tri-articulado de parede para TV/Monitor de 10"" até 55"" preto",47,(116)
Cortina De Puerta De Ventana Floral Transparente De Gasa,78,
Licor Espanhol Fino Anis Del Mono 700ml,119,(7)
Casaco Espesso De Lã De Cordeiro Feminino,204,
"Papel De Parede Listras Cinza 9,5mx52cm Begônia",189,
Coloraçao Itallian Color 5.14 Castanho Claro Cinza Cobre 60g,30,
"Vinho tinto meio seco Cabernet Sauvignon, Carménère Santa Carolina Reservado 2018 adega Viña Santa Carolina 750 ml",34,
"Lixeira Seletiva Recycling Papel 40,5 L Ixaz Com",299,
Vinho tinto seco Cabernet Sauvignon Santa Carolina Reserva 2017 750 ml,74,(5)
Torneira De Parede Para Lavatório Horus 450 1199 Cromado Fan,449,(11)
Extrator Cureta Tira Acne Cravos E Espinha Limpeza Aço Inox,21,
Suporte Tripé Apoio Pernas Veneza Manicure Pedicure Dompel,199,
Kit 15 Cuecas Boxer + 12 Pares De Meias Revenda Polo Voker,159,(103)
Kit 6pc Registro De Esfera Soldavel C/união 50mm  - Tigre,372,
"Caixa Organizadora Fit Ultra 38x31,5 Cm Vd Com",99,
Manta Para Sofá Gigante Cama Coberta Viena 170x140,69,(251)
Ralo 10x10 Oculto Seca Piso/porcelanato Inteligente Branco,31,(55)
Kit 2 Camisas Polos Masculinas Especiais Lisas Mr. Kitsch,172,(50)
Sapato Feminino Casual Microperfuros Preto Moleca,109,
Tênis Masculino Vision Ii Preto E Chumbo Tamanho 40 Rainha,179,
Sapatilha Feminina Espadrille Preta Vizzano,129,
Sandália Feminina Tiras Finas Transpassadas Bege Vizzano,139,
Touca Silicone P/ Mechas Luzes Reflexo + Agulha Profissional,24,
Vermute Extra Dry Martini Garrafa 750ml,36,
Bota Galocha Pvc Impermeável Acqua Boots + Brinde,61,(103)
Papel Semi Kraft Bobina 60cm 2kg Pardo Embalagem Caixa,26,(20)
Camiseta Aeroready Made For Training - adidas,129,
Carrinho Auxiliar Organizador Para Salão De Beleza 6 Gavetas,799,(6)
Kit Com 6 Calcinhas Femininas Biquíni Em Microfibra Trifil,104,(21)
Sandália Feminina Rasteira Pelica Com Pedraria Bege Vizzano,169,
Camiseta Ass Institucional Basic Cavalera,139,
Sapatilha Bico Redondo Com Laço Verde Moleca,69,
Porta-cartões Clássica Pequena Com Alça Nude Anacapri,99,
Mascara de Hidratação Intensiva Trivitt 1kg,136,(274)
Protetor Solar Para Sol Laminado Dianteiro Painel Luxcar,32,
adidas Deportivo Indoor IC Cimento Homem Adultos,185,(12)
Escova De Banho Lavar Costas Cabo Longo Bucha Massageadora,29,(6)
Escova De Pentear Cabelo E Desembaraçar Raquete Profissional,39,
Vinho tinto seco Carménère Santa Carolina Reserva Estrellas 2017 adega Viña Santa Carolina 750 ml,56,(4)
Tênis Feminino Flatform Branco Anacapri,229,
Kit Hidratação Trivitt Profissisional Itallian Reconstrução,431,(26)
Kit Com 4 Cuecas Masculina Boxer Com Cós Elástico D'uomo,109,(64)
Camiseta Gola Careca Reserva,169,
Cachaça Ouro Espírito de Minas Garrafa 700ml,91,(5)
Hohem Gimbal Isteady X Estabilizador Para Celular 3 Eixos,519,
Tênis Masculino Galaxy 5 Cinza adidas,349,(85)
Hohem Gimbal Isteady X Estabilizador Para Celular 3 Eixos,519,
Olympikus Easy Mulher Adultos,169,(586)
Camiseta Masculina Gola Careca Reserva,169,(8)
Camiseta Masculina Silk Mc Euro Volcom,89,(9)
Camiseta Masculina Estampada Block R Reserva,169,
Sandália Feminina Couro Plataforma Baixa Preta Usaflex,249,
Escova Mágica De Desembaraçar Pentear Cabelo Profissional,27,
Kit Com 3 Camisetas Masculina De Gola V Basicamente,179,(9)
Sapatilha Feminina Napa Monograma Marrom Vizzano,109,(4)
Bola 22 Society - Topper,61,(24)
Touca Difusora Toca Cetim Cachos Secadora Cabelo Anti-frizz,69,
Tênis Feminino Turbo Olympikus,229,(13)
Espanador Cabelo Talqueiria Salão Beleza Pincel Super Macio,24,
Bota Feminina Cano Curto Com Salto Quadrado Modare,189,(7)
Kit 3 Pares De Rasteirinha Feminina Laço Dali Shoes,169,(54)
Limpa Tênis Premium Petroplus,29,
Kit 2 Camisetas Feminina Proteção Uv Sports Preto Local,79,(19)
Vinho Português Fonte Branco 750ml Aveleda,94,
Sandália Preto Usaflex,289,
Sandália Salto Bloco Em Couro Liso Preto Usaflex,269,
Relógio Masculino Big Ben Detalhes Dourado Triton,249,(6)
Sapato Scarpin Feminino De Salto Baixo Preto Usaflex,279,
Gin Japonês Suntory 700ml Roku,212,
Bacia Para Pés Pedicuro Spa Relaxamento Escalda Pés Limpeza,19,
Vinho Branco Português Alentejo 750ml Terras D'el Rei,49,
Tênis Feminino Dad Sneaker Solado Plataforma Dakota,239,
Tênis Masculino Cano Alto Cavalera,329,(4)
Kit Com 3 Blusa Gola V Volare,116,(6)
Vinho Tinto Italiano Valpolicella Cornale 750ml Cantina,109,
"Vinho branco seco Chardonnay, Chenin Blanc Astica 2020 adega Bodegas Trapiche SAICA 750 ml",48,
Kit 3 Pares De Sapatilha Feminina Adulto Com Laço Dali Shoes,179,(24)
Olympikus Easy Mulher Adultos,169,(586)
Kit 3 Camisetas Manga Curta Masculina Com Bolso Surf Local,131,(41)
Brandy Jerez Solera Gran Reserva Carlos I Garrafa 700ml,299,
Kit 3 Camisetas Masculino Azul Marinho Basicamente,111,(11)
Touca Decetim Difusora P/ Definir Cachos Anti-frizz Original,52,
Calça Masculina Logo Básico Calvin Klein,339,
Chapinha de cabelo MQ Professional Hair Styling Titanium azul 110V/220V,459,(618)
Camiseta Masculina Estampada Patch R Reserva,169,
Cerveja Wals Verano Pale Ale One Way 600ml,15,
Bota Masculina Cano Curto Preta Cavalera,299,
Camiseta Masculina Estampada Pica Pau Reserva,189,
Vinho Tinto Seco Intenso Merlot 750ml Salton,45,
Touca Térmica Elétrica Metalizada Tratamentos Capilares 220v,59,
Gin Monkey 47 Schwarzwald Dry 500 mL,379,(8)
Camiseta Masculina Logo Centralizado Calvin Klein,159,
Perfume Masculino Man Blue Eau De Toilette 100ml Jimmy Choo,679,(26)
Camiseta Feminina Esportiva Aeroready D2m adidas,119,(5)
Kit 10 Cuecas Boxer Algodão Cós Elástico Camuflado Polo Wear,199,(67)
Cachaça Prata Saliníssima Garrafa 670ml,29,
Kit Com 2 Cuecas Boxer Masculina Preto Calvin Klein,179,(4)
Secador de cabelo MQ Professional Vênus chumbo 127V,582,(70)
Escova Cabelo Raquete Profissional Almofadada Cabeleireiro,39,(4)
Tênis Feminino Courtpoint Base Womens Day Branco adidas,349,
2 Tapete Peludo Pequeno Sala Cozinha Quarto Bem Vindo 60x40,34,(190)
Rum Caribenho 700ml Sailor Jerry,165,
Tênis Feminino Manila Detalhe Zíper Branco Kolosh,149,
Tênis Feminino Slip On Básico Bege Beira Rio,89,(28)
Cinto Masculino Casual Em Couro Cavalera,119,
Whisky Honey 750ml Evan Williams,156,(11)
Maleta Manicure Organizadora P/ 68  Esmaltes + Porta Acetona,339,(12)
Tênis Masculino Racer Tr 21 Preto adidas,499,(10)
Conjunto Calça E Blusão Moletom Infantil Be Love Elian,134,
Camiseta Masculina Indie Gola V Basic King Cavalera,149,
Camiseta Masculina Espinha De Peixe Reserva,189,
Sandália Rasteira Feminina Tira Única Preto Dakota,89,(4)
Sandália Rasteira Feminina Com Pedraria Nude Beira Rio,99,
Saboneteira Plastica Porta Sabonete Para Pia Banheiro,11,
Chinelo Feminino Birken Julia Ouro Metalizado Ramarim,99,
Sake Seco 750ml Daiki,24,
Calça Masculina Jeans Skinny Azul-marinho Calvin Klein,329,
Kit 2 Calças Moletom Feminino Plus Size Basicamente,208,
Licor Gf 700ml Tia Maria,167,
Bota Feminina Cano Curto Com Salto Quadrado Preto Colcci,289,(7)
"Vinho rosé suave Syrah, Merlot Benjamin Nieto Senetiner 2018 adega Bodegas Nieto Senetiner 750 ml",39,(4)
Sandália Rasteira Feminina Trançada Nude Vizzano,119,(6)
Gin Scotch Dry 700ml The Botanist,507,
Carrinho Auxiliar Coloração + 3 Kit Tintura Cumbuca + Pincel,298,
Lavatório De Barbeiro Portátil Cuba Móvel Ducha Salão Beleza,449,(10)
Camisa Masculina Polo Filete Mr. Kitsch,75,(12)
Bermuda Masculina Casual Iron Continuo Reserva,349,
Chinelo Unissex Top Pride Preto Havaianas,50,(36)
Dewar's Blended The Monarch 15 Reino Unido 750 mL,235,(15)
Tênis Feminino Slip On Casual Calce Fácil Kolosh,159,(14)
Sapatênis Masculino Cano Baixo Casual Polo Wear,129,(33)
Bota Feminina Cano Curto Com Fivelas Modare,209,(7)
Kit Presilhas Jacaré Prendedor Cabelo Bico De Pato C/ 12 Und,14,
Rum Brasileiro Carta Branca Mojito Bacardi Garrafa 980ml,39,
Cirandinha Cadeira Manicure Retrátil C/ Suporte Apoio Pernas,1.399,(28)
Cortador de cabelo MQ Hair Gold Series Force Brave  gold 110V/220V,579,(34)
Carrinho Auxiliar Salão De Beleza Estética  6 Gavetas Bivolt,799,(20)
Bermuda Masculina Sarja Color Reserva,329,
Maker's Mark Bourbon Estados Unidos da América 750 mL,219,(61)
Camisa Polo Masculina Especial Lisa Mr. Kitsch,86,(61)
Suporte Note Apoio Notebook Laptop Computador Mesa Universal,69,
Gin Theros Dry 1 L,42,
Tênis Feminino Slip On Detalhe Listras Bege Modare,139,
Coloração Itallian Color 8.44 Louro Claro Cobre Intenso 60g,30,(9)
Mule Feminino Em Pelica Detalhe De Laço Amarelo Vizzano,109,
Vinho Tinto Secret Reserve Red Blend 750ml Santa Rita,69,(8)
Escova Mafe De Desembaraçar Pentear Cabelos Profissional,12,
Camiseta Masculina Indie Águia Média Cavalera,129,
Central Multimídia Mp5 2 Din Com Tv Digital Com Camera De Ré,543,
Relógio Masculino Berlim Dourado Dumont,329,
Calça Masculina Essentials Logo Pequeno Preta adidas,249,
Chinelo Feminino Slim Neon Glow Havaianas,61,(31)
Chapinha de cabelo MQ Professional Hair Styling Titanium marsala 110V/220V,459,(618)
Pincel De Coloração E Química Largo P/ Aplicação Tratamento,12,
Pente Jacaré Desembaraçador Cabelos Cacheados Dompel Pt,9,
Espumante Argentino Branco Demi-Sec Cuvée Réserve Mumm Chardonnay Pinot Noir Mendoza Garrafa 750ml,76,(17)
Estojo Para Escova E Pasta Higiene Dental + Espreme Tubo,17,
Kit Com 6 Cuecas Masculina Boxer Max Zorba,179,(38)
Pente Profissional Comare Em Nylon Antiestático Suporta180°c,14,
Pedicuro Lixa Elétrica Esfoliador Pés Profissional + 12 Lixa,299,
Pedicuro Lixa Eletrica Pés Esfoliador Profissional + 12 Lixa,298,
Tênis Feminino Response Run adidas,399,(5)
Kit Gin Presente 2 Garrafas 1 Litro E 4 Taças Becosas,99,(9)
Whisky Fire Jim Beam 1l,134,(31)
Tênis Feminino Plataforma Detalhe Em Corrente Dakota,199,
Vinho rosé seco Uvas Diversas Casillero del Diablo Reserva adega Concha y Toro SA 750 ml,74,(67)
Pente Profissional Carbono Antiestático Ion Suporta 180º,19,
Vinho tinto seco Malbec Santa Helena Reservado 2020 adega Santa Helena 750 ml,51,
Tripe Tatuador Dompel Apoio De Braço Revolution C/ Regulagem,499,(19)
Pente Garfo Black Power Para Cabelo Crespo Afro E Cacheado,9,
Camiseta Básica Masculina Mr. Kitsch,99,(9)
Vinho Tinto Seco Intenso Cabernet Sauvignon 750ml Salton,45,
Tênis Feminino Com Perfurações Rosa Moleca,99,
Vinho Argentino Branco Suave Refrescante Benjamin Nieto 750ml,39,
Camisa Polo Masculina Sortidas Meia Malha Polo Wear,79,(13)
Tênis Feminino Básico Casual Cadarço Areia Vizzano,139,
Kit 10 Cuecas Boxer Algodão Cós Elástico Polo Wear,279,(77)
Massageador Elétrico Portátil Profissional Muscular Pistola,155,
Caneca Mágica Presente Para O Dia Dos Pais Meu Pai Meu Herói,39,(14)
Sapateira E Banco Porta Entrada 2 Prateleiras Safira - Cores,141,(89)
Sapatênis Masculino Couro Cernan Cavalera,199,(69)
Prendedor De Cabelo Plástico Clip Bico Pato Cabeleleiro C/ 6,21,
Vinho tinto meio seco Merlot Reservado Reservado 2019 adega Concha y Toro 750 ml,39,(74)
Sandália Feminina Rasteira You St Tropez Basic Havaianas,71,(37)
Bola Society S11 R2 X X I I Penalty,139,
Bota Feminina Coturno Bebecê,199,(7)
Tênis Masculino Frontier X I Preto Topper,139,(18)
Vinho Rosso Italiano Conte Corsano 750ml Castellani,87,
Jim Beam Bourbon Black Estados Unidos da América 1 L,186,(103)
Blusa Manga Curta Com Transpasse Bjoe - Cativa,29,
Bigodim Circular Dompel Bigodinho Nº 2 Médio Kit Com 12 Und,14,
Navalhete Profissional Retrátil Cabo Plástico P/ Barbear,14,
Kit Tigela Coloração Quimica Cumbuca + Pincel Tintura +pente,19,
Mascara De Hidratação Para Cabelos Ressecados Itallian 2kg,139,(4)
Lixa De Pés Pedicure E.v.a. Anatômica Dompel Com 2 Lados,7,
Estufa Manicure Forninho Esterilizador Para Alicate Cutícula,299,(4)
Blusa Moletom Essentials 3-stripes adidas,279,
"Manta Sofá / Cama 1,80×2,20m Decorativa Colorida",51,(729)
Refil Plástico Protetor Descartável Termoceras Com 6 Folhas,16,
Carrinho Auxiliar Organizador Multiuso Salão Beleza 4 Gaveta,329,
Kit 100 Espatula Palito De Madeira Para Depilação Creme,26,
Escova Profissional De Desembaraçar E Pentear Cabelo Mágica,24,
Vinho Tinto Chileno 120 Reserva Merlot 750ml Santa Rita,59,(7)
"Kit Touca Para Mechas, Luzes E Reflexo Em Silicone + Agulha",39,
Bacia Para Os Pés Pedicuro Manicure Spa Relaxamento  Limpeza,29,
Máscara Facial Anti-idade Grapefruit Mask Toranja Océane,32,
Espanador De Cabelo Barbeiro E Salão De Beleza Profissional,34,
Protetor De Pescoço Para Lavatório Salão Cabelereiro Espuma,15,
Sandália Feminina Class Easy Ipanema,29,(12)
Esponja Nudred Profissional Dompel Bucha De Cabelo Afro 1 Un,19,
Touca Para Reflexo Alinhado Mechas Siliconada Cabelereiro,41,
Capa Para Volante Carro Macia Cinza Universal,35,
Protetor De Colchão Impermeável Queen Algodão Kacyumara,158,(13)
Papel Depilatorio Tnt Visual Lenço Falso Tecido 100 Unidades,27,
Chinelo Masculino Top Marvel Classics Havaianas,46,(23)
Bacia Com Pedestal De Pedicure Relaxamento Spa Dompel,39,
Pincel De Barbear Cerdas Macias Dompel Cabo De Madeira,25,
Chinelo Masculino R1 Ad Verde E Preto Rider,29,(4)
Chinelo Infantil Slide Estampa Tropical Laranja Molekinha,59,
Camiseta Feminina Loungewear Essentials Logo adidas,129,(4)
"Touca De Silicone P/ Mechas, Luzes Reflexo Original + Agulha",27,
Vinho 3 Medallas Sweet Sauvignon Blanc 750ml Santa Rita,49,
Chinelo Baby Flamengo Manto Clássico  Listrado Neorubber,59,(5)
Camiseta Feminina Essential Esportiva Preta Olympikus,59,
Coloraçao Itallian Color Professional Cb Corretor Azul 60 G,30,
Difusor De Ar Universal Para Secador De Cabelo Ativa Cachos,55,(5)
Chinelo Slide Tira Grossa Multi Color/ Ligth Turquesa Moleca,69,
Touca Difusora Secadora De Cetim Cachos Perfeitos Anti-frizz,52,(6)
Touca Silicone Cabelo Mechas Luzes Reflexo Peluqueiro Dompel,29,(538)
Sandália Rasteira Feminina Pelica Tira Laranja Vizzano,79,
Sandália Rasteira Feminina Tiras Cruzada Preto Beira Rio,79,(9)
Coloração Itallian Color Professional 9.89 (989) Pérola 60g,30,
Difusor Secador Cabelo Profissional Universal Definir Cachos,79,(67)
Escova Mágica De Desembaraçar Pentear Cabelo Profissional,19,
Sapatilha Feminina Detalhe Corrente Areia Moleca,59,
Sandália Feminina Rasteira Avarca Laranja Vizzano,69,
Kit 3 Camisetas Infantil Feminina Básica Dali,99,(10)
Touca Descartável Tnt Branca Sanfonada 50 Unidades C/ Anvisa,32,
Sandália Rasteira Feminina Detalhe Metalizado Beira Rio,79,(20)
Coloração Itallian Color 12.89 Louro Ultra Claríssimo Perola,30,
Camisa Masculina Slim Manga Longa Calvin Klein,339,
Chinelo Flamengo Manto 2° Clássico Branco Neorubber,69,(14)
Sandália Rasteira Feminina Detalhe Em Laço Preto Vizzano,99,(12)
Touca Profissional Térmica Para Hidratação Cabelo Metalizada,18,
Vinho Chileno 3 Medallas Sweet Rosé 750ml Santa Rita,49,
Fita Led 120led/m Ip20 12v 3528 Para Perfil 5 Metros Quente,32,
Kit Baby Estampado Com 2 Body E 1 Calça Ratinha Love Elian,89,(9)
Tenis Slip On Knit Taiwan Nude Beira Rio,89,
Fita Isolante Anti Chama Atacado 10m C/ 10 Unidades,29,(10)
Bermuda Masculina Básica Cinza Escuro Topper,69,(24)
Sapatilha Bico Redondo Laço Rosa Moleca,69,
"Kit C/ 15 Toalhas De Banho - 65cm X 1,25m (270gm²) Atacado",229,(1005)
Chinelo Top Lilás Escuro Havaianas,25,(112)
Sandália Rasteira Pelica Tira Trançada Rosa Vizzano,119,
Bermuda Masculina New Classic Preto Topper,79,(14)
Sandália Feminina Sucesso Com Tiras Zaxy,49,(14)
Sandália Feminina Rasteira Tiras Finas Rosa Moleca,79,
Adesivo Poliuretano Pu 40 Vidro Metal Juntas Dilatação 400g,33,(15)
Sandália Rasteira Feminina Básica Preto Beira Rio,99,
Sandália Rasteira Feminina Flash Urban Havaianas,44,
Sandália Feminina Oliva Natural Vizzano,129,
Sandália Rasteira Feminina Com Nozinhos Azul Vizzano,99,
Sandália Feminina Rasteira You St Tropez Color Havaianas,77,(15)
Óculos De Sol Original Com Proteção Uv Preto Les Bains,119,
Kit 3 Cuecas Básicas Slip Cós Elástico Mash,56,(501)
Sandália Feminina Tira Única Fina Pedraria Camel Moleca,69,
Tamanco Feminina Flatform Fivela Camel Vizzano,129,
Chinelo Masculino Estampa 4 Nite Havaianas,42,(22)
Sandália Rasteira Feminina Em Matelassê Preto Vizzano,119,(13)
Sandália Rasteira Feminina Detalhe Em Nó Areia Beira Rio,109,
Rasteira Metalizada Premium Nó Dourado Vizzano,109,
Camiseta Masculina Silk Wave Two Mescla Vermelho Hurley,102,
Tênis Feminino Casual Napa Cobra Luxo Branco Beira Rio,139,
Camiseta Masculina Silk Manga Curta Logo Branco Hang Loose,79,
Kit 3 Babylooks Feminina Gola C Mescla Basicamente,97,(4)
Tênis Masculino Vulc Raid3r Skateboarding adidas,299,(9)
Kit Com 2 Camisetas Femininas Multicolor Polo Wear,79,(22)
Sandália Rasteira Feminina Pelica Camel Vizzano,99,
Conjunto Pijama De Frio Teen Menina Estampa Unicórnio Elian,89,
Kit 3 Babylooks Feminina Gola V Mescla Basicamente,97,(9)
Escova Profissional Térmica 33mm Cerdas Mistas Dupla Altura,117,
Chinelo Feminino Slide Com Aplicação De Spikes Preto Moleca,69,
Blusa Feminina Bio Galáxia Branco Fila,99,
Kit Com 3 Regata Ribana Canelada Volare,108,(15)
Paleta De Sombras Let It Shine Mariana Saad By 9g Océane,148,(296)
Alpargata Feminina Matelassê Tressê Branco Vizzano,139,
Tênis Feminino Básico Preto Beira Rio,119,
Kit Masculino Infantil Preto Saruel Body Elian,83,(7)
Sandália Feminina Salto Anabela Palha Bege Beira Rio,119,
Kit 12 Pares Meias Infantil Antiderrapante Meninos Promoção,39,(88)
Rasteirinha Trançada Cereja Vizzano,129,(4)
Cardigan Feminino Adulto Plus Size Maelle,109,
Sapato Feminino Tachas Fivela Preto Com Bege Vizzano,169,(7)
Sandália Feminina Tiras Trançadas Tamanho 36 Dakota,109,
Sandália Feminina Plataforma Palha Nude Beira Rio,119,
Kit 3 Body Surtido Menino Baby Elian,71,(10)
Pente Masculino Especial Cabelo E Barba De Bolso Desembaraça,19,
Tênis Feminino Casual Detalhe Tratorado Areia Beira Rio,99,(5)
Vinho tinto meio seco Carménère Santa Carolina Reservado 2018 adega Viña Santa Carolina 750 ml,33,(15)
Kit 2 Calças Legging Femininas Ciclista Preto Basicamente,79,(8)
Sandália Feminina Tiras Em Elástico Nude Modare,99,(6)
Calção Masculino De Futebol Dominador Preto E Verde Topper,69,(9)
