name,preco,avaliacao
Tênis Feminino Com Solado Em Plataforma Marinho Moleca,109,(8)
Kit Pijamas Feminino Shortdoll E Camisola Preto Texcriar,129,(9)
Tênis Feminino Slip On Nude Beira Rio,109,
Saia Jeans Feminina Cós Elástico E Botão Cintura Alta Sawary,99,
Top Cropped Feminino Rtg Bra Crop Preto Puma,119,
Tênis Feminino Casual Preto E Branco Moleca,99,
Sandália Feminina Tiras Em Elástico Jeans Modare,99,(4)
Tênis Feminino Slip On Costuras Preto Beira Rio,99,
Registro Para Lavatório De Cabelo Torneira Original Dompel,59,(9)
Coloração Itallian Color 6.0 Louro Escuro Profissional 60g,30,
Conjunto 2 Peças Menino 1° Passos Blusa Skater Calça Elian,69,(13)
Conjunto Infantil Com 4 Peças Menino Dinossauro Elian,78,(4)
Mocassim Feminino Bico Redondo Detalhe De Nó Beira Rio,99,(6)
"Tapete Passadeira 2,00m X 0,60m Corredor Quarto Sala Felpudo",79,(16)
Sandália Feminina Camurça Flex E Pelica Bege Vizzano,129,
Carteira Feminina Multi Bege Vizzano,139,
Sapatilha Feminina Com Detalhe De Nó Preto Vizzano,99,
Hidratação Intensiva Trivitt  250g Original Itallian,57,(13)
Coturno Masculino Aston Cano Médio Com Cadarço Ollie,109,(15)
Chinelo Feminino Slim Paisagem Havaianas,50,(49)
Emulsão Oxidante Estabilizada 30 Volumes Itallian Color 1l,71,
Kit Com 3 Blusas Feminina Decote V Volare,119,(30)
Kit 2 Calças Legging Feminina Basicamente,129,(10)
Tênis Feminino Com Recortes A Laser Camel Modare,129,
Kit Com 2 Cuecas Boxer + 3 Pares De Meias Médias Loa,59,(146)
Sandália Feminina Rasteira You St Tropez Havaianas,77,(30)
Vinho Chileno Gran Hacienda Carménère 750ml Santa Rita,54,
Sandalia Vizzano Glamour  6375-723-12220 Bege,139,
Kit 3 Camisetas Manga Curta Masculina Gola Portuguesa Local,141,(47)
Bola Recreativa Alfa T12 X X I Amarelo Penalty,89,
Sandália Feminina Plataforma Acabamento Juta Preto Vizzano,129,(9)
Canetinha Colorida Hidrográfica 24 Cores - Atóxica - Leo&leo,24,(19)
Kit Pinça Bandeja Inox Estufa Esterilizador Alicate Cutícula,33,
Camiseta Masculina Silk Box Preto Mescla Hurley,123,(5)
Sandália Feminina Rasteira Tira Transparente Branca Moleca,69,
Sandália Feminina Rasteira Tiras Couro Com Tachas Anacapri,129,
Relógio Feminino Analógico Pulseira Em Silicone Triton,169,(7)
Sandália Anabela Com Tiras Transpassadas Preto Vizzano,139,
Vinho Tinto Argentino Reserva Cabernet Franc 750ml San Pedro,150,
Escova Desembaraçar Cachos Pente Polvo Cabelo Afro Flexivel,29,
Vinho Chileno Gran Reserva Carménère 750ml Santa Helena,149,
Camiseta Comfort Moto Pontilhism Cavalera,156,
Sapatilha Feminina Casual Listras Multi Violeta Moleca,69,
Sandália Feminina Rasteira Palha Bordada Anacapri,139,
Sandália Pelica Jeans Vizzano,99,
Bola Slick Cup Futsal Topper,81,(9)
Sandália Anabela Tramas E Amarração Gorgurão Vizzano,149,
Sapatilha Feminina Com Listras Multi Rosa Moleca,69,
Vinho Chileno Medalla Real Gold Carménère 750ml Santa Rita,129,
Chuteira Slick Iii Scty Marinho/coral 41 Topper,139,
Sutiã Feminino Com Bojo Ampla Cobertura Em Poliamida Trifil,104,(29)
Sandália Feminina Salto Bloco Nó Texturizado Preto Vizzano,119,(5)
Calça Feminina Runner Preta Olympikus,149,
Tênis Masculino Básico Preto Colcci,179,(6)
Tênis Feminino Ultra Conforto Preto Modare,159,
Kit 06 Caneca Coração Amor Sucesso Frases 250ml Porcelana,78,(6)
Sandália Feminina Rasteira Tiras Cruzadas Preta Moleca,69,
Tonalizante Coloratto Sem Amonia 7.0 Louro Medio 60g,33,
Aquecedor De Cera Quente Rollon Depilador Eletrico Termocera,111,(6)
Sapato Mocassim Com Detalhes Rendados Branco Modare,149,
Chinelo Feminino De Dedo Flip Flop Preto Moleca,89,(4)
Vinho Tinto Chileno 120 Reserva Carménère 750ml Santa Rita,59,(9)
Sandália Rasteira Feminino Básica Bege Modare,109,
Camiseta Masculina Silk Born From Water Hurley,279,
Tapete Térmico Tatame Gigante Infantil Educativo Para Bebê G,64,(48)
Kit Com 6 Camisetas Masculinas X-temp Branco Hanes,189,(33)
Camiseta Masculina Águia Geométrica Cavalera,149,
Kit Com 3 Pares De Papete Feminina Dali Shoes,199,(20)
Bolsa Shopping Transparente E Necessaire Mostarda Vizzano,199,
Calça Feminina Legging Essentials Logo Metalizado Preto Puma,159,
Sandália Rasteira Feminina Com Tiras Nó Nude Moleca,69,
"Mini Balança Digital De Bolso E Alta Precisão 0,1g Até 500g",34,(741)
Sandália Rasteira Feminina Tiras E Nó Cereja Vizzano,99,(7)
Tênis Masculino Jogging Kuper Azul Escuro Ollie,99,(618)
Máscara Térmica Facial Elétrica Para Limpeza De Pele E Cravo,78,(5)
Tênis Feminino Slip On Princess Preto E Bordô Rainha,129,(9)
Vinho Branco Seco Chileno Três Medallas 750ml Santa Rita,49,
Vinho Seco Secret Reserve Cabernet Sauvigno 750ml Santa Rita,69,
Kit 3 Pulseira Colorida Mi Band 4 /mi Band 3  Pronta Entrega,29,(467)
Tênis Feminino Slip On Matelassê Branco Modare,149,
Kit De Frascos Para Viagem 10 Peças Necessaire Organizador,38,(12)
Tênis Feminino Esportivo Magic Rainha,159,(20)
Sandália Feminina Euforia Partner Zaxy,69,(15)
Sandália Rasteira Feminina Básica Preto Vizzano,109,(19)
Camiseta Masculina Logo Palito Branco Calvin Klein,159,
Relógio Digital Inteligente Smartwatch D20 Feminino Masculin,89,(87)
Boardshorts Solar Flower Azul Volcom,249,
Difusor De Ar Universal Para Secador De Cabelo Ativa Cachos,39,(20)
Central Multimídia Mp5 2 Din Com Tv Digital First Option,577,(12)
Kit Com 6 Cuecas Masculina Slip Comfort Branco Zorba,139,(52)
Camiseta Masculino Logo Básico Peito Cinza Calvin Klein,149,
Tênis Feminino Casual Cano Curto Bege Beira Rio,99,(4)
Sandália Feminina Rasteira Detalhe Em Pedras Nude Modare,109,
Tênis Masculino Casual Têxtil Since 1986 Azul Marinho Colcci,189,(8)
Kit Com 8 Cuecas Masculina Boxer Cotton D´uomo,259,(26)
Luminaria Solar Luz Led Com Sensor De Presença Automático,36,(105)
Camiseta Paris Reserva,169,
Maçaneta Alavanca P/ Porta - Cromada 86617 Aliança,27,(48)
Led Tubular T5 120cm 20w C/calha Completa Luz Frio,38,(22)
Camiseta Cavalera Aguia Papel Rasgado,139,
Calha Lava Fácil Lavatório Portátil Cabelo Mini Ducha Dompel,169,(18)
Gin Espanhol Atlantic Galician Nordes 700ml,209,
Kit 2 Bermudas Masculina De Moletom Local,143,(49)
Massageador Elétrico Portátil Profissional Muscular Pistola,157,(228)
Kit 6 Pares De Meias Esportivas Sapatilha Branca Hanes,79,(7)
Tênis Feminino Mali Preto Kolosh,129,(6)
Camiseta Masculina Logo Palito Preto Calvin Klein,159,
Vinho branco meio seco Chardonnay Santa Carolina Reservado 2018 adega Viña Santa Carolina 750 ml,32,
Difusor Secador De Cabelo Dompel Universal Definir Cachos,39,(116)
2kg Aveia Em Flocos Grosso Premium - Cód. 1285,22,
Bolsa Feminina Shopping Alça Dupla Branca Anacapri,299,
Chinelo Feminino Em Couro Com Tira Única Usaflex,249,
Sapatênis Masculino Flat Lancer Café Ollie,79,(218)
Tênis Feminino Slip On Preto Usaflex,269,(4)
adidas Deportivo Indoor IC Cimento Homem Adultos,185,(12)
Papete Vera Soft Therapy Com Fecho Fácil Azaleia,119,(4)
Sapato Scarpin Feminino Salto Bloco E Bico Fino Preto Modare,159,(10)
Relógio Masculino Detalhes Em Laranja Analógico Triton,249,(4)
Tênis Feminino Plataforma Casual Caramelo Colcci,259,(4)
Sandália Feminina Slim Nautical Havaianas,43,(70)
Camiseta Estampada Aguia Box Desgaste Cavalera,149,
"Vinho tinto seco Uvas Diversas, Montepulciano Corbelli 2017 adega Castellani Spa 750 ml",74,(18)
Vinho Tinto Seco Secret Reserve Pinot Noir 750ml Santa Rita,69,
Sandália Feminina You Metallic Havaianas,55,(34)
Kit 20 - Toalhas De Rosto Para Salão - Nobre - Promoção,139,(210)
Tênis Masculino Lona Têxtil Eloi Cavalera,229,(15)
Vinho branco suave Lambrusco Villa Fabrizia Amabile 750 ml,34,(10)
"Tapete Passadeira Sisal 66cm X 1,80m Antiderrapante Cozinha, Sala Quarto Tabaco Lâncer",110,(2261)
Camiseta Masculina Silk Manga Curta Leaves Hang Loose,87,
Kit Com 6 Cuecas Masculina Boxer Cós Elástico D'uomo,149,(96)
Calça Cargo Jogger Feminina Bolso Refletivo Tumblr,69,(36)
Kit 10 Cuecas Boxer Algodão Cós Elástico Prata Polo Wear,199,(52)
Tênis Masculino Lona Têxtil Yohan Cavalera,229,(4)
Chinelo Sandália Ortopédica Pisar Nas Nuvens Leve Ortopédico,54,(4)
Sapatênis Masculino Em Malha Cano Curto Polo Wear,129,(29)
Bota Feminina Básica De Salto Fino Café Colcci,299,(13)
Kit Gin Espanhol 700ml + Taça Exclusiva De Vidro Nordés,249,
Panelinha Depilação Termocera Aquecedora Cera Quente 500g,219,(10)
Protetor De Colchão Impermeável Solteiro Algodão Kacyumara,110,(14)
Sapato Salto Bloco Napa Glossy Vizzano,209,
Conjunto De Frio Manga Longa Listrado Branco Preto E Telha,78,(26)
Kit 3 Camisetas Manga Curta Masculinas Gola Redonda Local,122,(75)
"Descolorante, Oxidante Dyusar Professional Pó active blond + ox 30 volumes",78,(243)
Sandalia Kenner Kivah Adulto Kno-06 Original Feminino Masc,78,(14)
Difusor De Ar P/ Secador Universal Taiff Cachos Profissional,39,(17)
Tênis Unissex Clássico Jogging 100 Preto Olympikus,199,(120)
Blusa Masculina Moletom Windbreaker Cold Hurley,399,
Tênis Feminino Casual Slip On Preto Colcci,219,(7)
Kit Com 12 Cuecas Masculina Boxer Em Microfibra Rp,129,(680)
Suporte Tripé Manicure Apoio Das Pernas Para Pedicure Dompel,159,(156)
"Kit C/6 Toalha De Banho - Gigantes 80 X 1,50 - 500 G/m² Top",214,(3081)
Sapatênis Masculino Casual Em Couro Lucas Cavalera,219,
adidas Duramo SL Mulher Adultos,259,(16)
Lavatório Portátil Cabeleireiro Dompel Facile Salão Beleza,339,(90)
Apoio De Braço E Perna Para Tatuador Fit Tatoo Com Regulagem,249,(17)
Pedicuro Lixa Elétrica Esfoliador Pés Profissional +12 Lixas,299,(5)
Aparelho Adaptador Smart Tv Box Transforme Sua Tv Em Smarttv,199,
Lavatório Salão Cabeleireiro Portátil Cuba Móvel Ducha Lavar,399,
Jim Beam Bourbon Estados Unidos da América 1 L,143,(227)
Vinho Tinto Espanhol Ouro Tempranillo 750ml Pata Negra,85,(24)
Kit 3 Pares De Rasteirinha Infantil Duplo Dali Shoes,149,(8)
Kit Com 6 Calcinhas Femininas Tanga Em Microfibra Trifil,104,(10)
Tênis Masculino De Corrida Charged Prompt Under Armour,299,(9)
Máscara Facial Térmica Elétrica Limpeza De Pele 127v,79,(10)
Tripe Apoio De Braço Tatuagem Tatoo Pernas Suporte Tatuador,249,
Tênis Feminino Esportivo Racer Calce Fácil Kolosh,159,(4)
Conversor Smart Tv Box 64gb Ram + 512gb Pro 4k Android 11,189,
Promoção Sapatilha Feminina Verniz Bico Fino Confort Rf.222,52,(258)
Kit Com 8 Cuecas Masculina Boxer Com Cós Elástico D'uomo,199,(98)
Capinha Case Silicone Aveludado Redmi Note 10/10s Tela 6.43,29,(36)
Tênis Masculino Charged Slight Under Armour,329,(9)
Vinho tinto seco Malbec Trivento Golden Reserve 2016 750 ml,189,(4)
Tripé Pedicure Suporte Para Pés Apoio Braços Pernas Tatuador,188,(5)
Sapato Scarpin Feminino Vinil Transparente Vizzano,139,
Tênis Masculino Street Kallys Preto Ollie,99,(2002)
Camisa Masculina Polo Manga Curta Cavalera,189,(5)
Kit Manutenção Trivitt Home Care C/ Leave-in Hidratante 780g,132,(28)
Tênis Feminino Lite Racer 3.0 adidas,299,(6)
Tênis Feminino Run 60s 2.0 adidas,349,(5)
Kit Com 12 Cuecas Masculina Boxer Em Poliéster Red Nose,199,(461)
Kit 3 Polos Manga Curta Masculina Meia Malha Básica Local,165,(49)
Kit Manutenção Trivitt Home Care Hidratação Itallian 780g,132,(61)
Vinho tinto seco Carménère Marques de Casa Concha 2015 adega Concha y Toro 750 ml,189,(13)
Dreams Sunset  Edp 90ml,689,
Kit Com 10 Calcinhas Tipo Biquíni Em Microfibra Delrio,165,(263)
Camiseta Stranger Things Hellfire Club Manga Curta #1,45,
Vodka Elyx 750ml Absolut,160,
Tênis Feminino Grand Court Base Beyond adidas,349,(89)
Capa Pra Colchão Impermeavel Solteiro Box Matelado,60,(52)
Boardshorts Masculino Sunset Preto Hang Loose,239,
Pilha AAA Elgin Recargable 82169 Cilíndrica - kit de 4 unidades,24,(335)
Bermuda Modeladora Feminina Forte Compressão Abaixo Do Peito,89,(106)
Whisky 18 Anos Old Parr 750ml,501,(31)
Kit 3 Lustre Pendente Luminaria De Madeira Nácar Soquete E27,129,(31)
50 Toalhas De Rosto Para Salão - 100% Algodão 45 X 70cm,310,(55)
Suporte Tripé Manicure Apoio Das Pernas Para Pedicure Dompel,139,(99)
Tênis Masculino Street Masculino Civic Ollie,79,(2002)
Lavatório De Cabelo Portátil Cuba Móvel Salão Cabeleireiro,399,
Lavatório Dompel Facile Portátil Cabeleireiro E Salão Beleza,348,(63)
Jogo De Toalhas 4 Peças Santista Royal Knut 100% Algodão,78,(219)
Bomber Feminina Jaqueta College Blusa Colegial Blazer Frio,43,(29)
Tênis Feminino Citrus Chumbo Com Rosa Olympikus,179,
Vinho tinto seco Cabernet Sauvignon Casillero del Diablo Reserva Privada 2017 adega Viña Concha y Toro SA 750 ml,119,(31)
Kit Lâmpadas Techone Super Branca H7 + H1 Efeito Xenon 8500k,49,(208)
Kit 3 Camisas Uv 50 Segunda Pele Proteção Solar Unissex,119,(78)
Carrinho Auxiliar Poker Tatoo 4 Gavatas Tatuador E Estética,499,(15)
Vinho Chileno Tinto Seco Reserva Especial 120 Pinot Noir Valle de Aconcagua Garrafa 750ml,54,(15)
Limpa Pisos Pedra Antiderrapante Encardido Sem Esforço 5 L,59,(237)
Chuteira Infantil Artilheira V Futsal Branca Com Azul adidas,199,
Vestido Longo Transpassado Envelope Com Babado Decote Em V,159,(163)
Camisa Polo Masculina Ton Sur Ton Mr. Kitsch,75,(11)
Estufa Forninho Esterilizador Para Alicate Cutícula Manicure,299,(8)
Bota Masculina Caterpillar Original Coturno Mercado Envios!!,78,(15)
Tênis Black Free Infantil Crianca Boa Qualidade Conforto,109,(94)
Bota Feminina Cano Curto Com Salto Fino Preto Colcci,299,(12)
Toalha Banho Gigante Fio Penteado Lumina Karsten Kit 4 Peças,260,(11)
Perfume Masculino Blue Edt Man 125ml Alfa Romeo,343,
Bota Coturno Masculina Caterpillar Zip One Couro Promoção,189,(52)
Bolsa Feminina Shopper Grande + Bolsinha Promoção Lançamento,69,(35)
Carrinho Mega Hair Auxiliar Organizador Salão Beleza Dompel,699,(4)
Pedicuro Lixa Para Os Pés Tira Calo Profissional + 12 Lixas,298,
Bola Alfa T10 X X I Amarelo Penalty,89,
Câmera Ip Varredura Automática Ptz Noturna Wireless 720p,166,
Pijama Masculino Manga Longa Calvin Klein,359,
Kit 12 Cuecas Boxer Listradas Polo Wear,199,(34)
Kit Com 12 Calcinhas Femininas Biquíni Em Microfibra Trifil,219,(13)
Jogo De Toalhas Buddemeyer Dual Air Banho 2 Peças,119,
Camisa Masculina Polo Logo Retângulo Calvin Klein,239,
Carrinho Auxiliar Para Coloração + Kit 3 Tigelas + 3 Pincéis,399,(6)
Manta De Microfibra Casal Grossa Lisa Varias Cores Rozac,59,(104)
Castanha Do Pará Sem Casca Quebrada - 1kg,67,(43)
Cabo De Rede Cat6 15 Metros Ethernet Lan Giga 10/1000,32,(80)
Tênis Feminino Run Falcon 2.0 adidas,299,(221)
Filtro Água Refil Vela Electrolux Pe11x Pe11b Pa21g 26g 31g,59,(36)
Bota Feminina Básica Ankle Boot Café Colcci,289,
Tênis Feminino Run Falcon 2.0 adidas,379,(221)
Kit 2 Camisetas Básicas Masculina Mr. Kitsch,199,(25)
10 Cuecas Box Polo Voker Infantil Atacado Original Cod.21,64,(273)
Kit 3 Polos Manga Curta Masculina Piquet Básica Local,180,(30)
2 Sensor De Presença Com Fotocélula Para Lâmpada Soquete E27,62,(1748)
Kit 20 Spot Led Smd 7w Dicróica Direcionável Redondo Forte,195,(118)
Caixa Organizadora Multiuso Plástica 56 Litros Kit 3 Peças,204,(181)
40 Toalhas Para Salão - 100% Algodão - Atacado,224,(357)
Lavatório Portátil Calha Lavar Cabelos Fácil Ducha Universal,329,(81)
Carrinho Auxiliar Organizador Multiuso Salão Beleza 4 Gaveta,568,(7)
Kit 10 Cuecas Boxer Algodão Com Cós Elástico Polo Wear,279,(33)
Carrinho Porta Esmaltes Expositor Maniure Dompel Giratorio,399,(5)
Calça Masculina Super Skinny Calvin Klein,379,
Kit 2 Lâmpadas Filamento Led Retrô Vintage 4w Quente St64,42,(133)
Lavadora de alta pressão Tramontina Residencial Master 42546 amarela e preta com 100bar de pressão máxima 220V,1.038,(1100)
Kit - 5 Toalhas De Banho - Atacado - Revenda 300 G/m,119,(189)
Jogo De Toalhas Banhão Karsten Lumina 4 Peças,261,(118)
Tênis Feminino Bordado Fé Salto Plataforma Detalhes Anabela,78,(907)
Tênis Feminino Ultraleve 119g Vanila Olympikus,229,(8)
Kit 10 Meias Sapatilha Unissex Especial Au Walk Branco Lupo,144,(33)
Bota Masculina Caterpillar Coturno Promoção+kit Acessorios,78,(101)
Bota Coturno Feminina Napa Vizzano,219,(6)
Lavatório Portátil  Calha Lava Cabelos Fácil Ducha Universal,449,(168)
Kit Com 10 Cuecas Masculinas Slip Sortidas Lupo,302,(111)
Coloraçao Itallian Color Professional 7.3 (27)louro Dourado,30,
Sabonete Vegetal Extrato De Camomila 80g Turma Da Monica,10,
Jogo Mexedores De Drinks Remo 4 Peças,99,
"Parafusadeira À Bateria 3,6v - Tramontina + Kit De Acessorio",220,(320)
Taca Cerveja Dublin Wuppertal Inmc Com,29,
Cadeira infantil para carro Chicco Seat4fix ombra,3.299,(10)
Jogo De Ferramentas Manuais Com 9 Peças Klatter,210,
Kit Bebê 2 Body Manga Curta Wondrus,131,
Caixa De Ferramenta Bau 30x16x8 S/ Bandeja R-30 - Marcon,56,
Cafeteira Cadence Trends Neo mint CAF209 semi automática neo mint de filtro 220V,189,(8)
Ativador Guanidina Forte Innovator Itallian 100 Ml,51,
Cafeteira Elétrica 25 Xícaras Thermo 110v,368,(143)
Carrinho Passeio 2 Em 1 Dobrável Moisés Jazz Fisher Price,2.349,
"Selante Acrílico Flexível 5kg, Interno E Externo Reparador",168,
Kit 4 Cuecas Low Rise Trunk Calvin Klein,299,
Limpador Kasão  Multiuso em frasco 500ml,15,
Sabonete Vegetal Óleo Essencial Lavanda Turma Da Mônica Baby,10,
Kit 10 Cto 1x16 Completas E Montadas C/nfe,1.599,
Aquecedor Elétrico Portátil 800w Branco Ventisol 220v,158,
Tupia Skil 1831 1100W 127V,999,(147)
Kit 3x Camisetas Curtas Wondrus,207,
Lâmpada De Escritório De Noche Com Sensor Movimiento Pir Led,82,
"Tapete Juvenil 1x1,5 Antiderrapante Belga Kids Colorido",75,
Vestido De Noite Curto De Manga Comprida,152,
Lixeira Inox C/pedal 5l Dercoline 3048/212 Brinox,159,
Escova Profissional Térmica 25mm Cerdas Nylon Dupla Altura,102,
Castiçal Olimpia Baixo,179,
Relógio Digital Champion Feminino Dourado Rose Gold Led,306,(22)
Saia Midi Cintura Alta Em Malha Hering,159,
Escadas Aluminio 3 Degraus Domestica Residencial Botafogo,258,(183)
Coloração Itallian Color 6.23 Louro Escuro Violeta Dourado,30,
Trena Fita De Aço 15mts Kts510-15m-s - Starrett,132,
"Lixeira De Pia Trium 2,5 L - Ou",59,
Casaco Trench Coat Masculino De Outono E Inverno,214,
Conjunto De Biquíni De Manga Comprida E Boxer,199,
Moletom Menina Malha Grossa De Manga Longa Preto Wondrus,74,
Kit De 142 Ferramentas + Paquímetro Digital 150mm Inox Mtx,248,
Limpador Casa & Cuidado Desinfetante Escudo Floral Uso Geral em frasco 500ml,16,
Maiô Elegante Com Decote Em V,167,
Funko Pop Mandalorian 370 Baby Yoda Star Wars Grogu Child,229,
Multiprocessador Oster Chrome 003320 125W preto 220V,279,(206)
Sapato Salto Fino Pelica Com Detalhe Dourado Vizzano,169,
Aspirador De Pó E Líquido 2800w 75 Lts. Aj 7558 - Jacto,5.858,
Jaqueta Masculina Casual Espessada,214,
Escova Mágica De Desembaraçar Pentear Cabelo Profissional,19,
Moletom Fechado Canguru Com Capuz Layers Hurley,389,
Toalha Para Pedicure Salão Beleza Atoalhada 72x 38cm Atacado,29,
Gatos 3d Cobra Brinquedo Usb Móvel Interativo Brincadeira,151,
Pendente De Teto Em Alumínio Begônia Bivolt,59,(12)
Aparelho De Fondue Friburgo 10 Peças - Home Style,139,
Sabonete Vegetal Hidratante Turma Da Mônica Baby Barra 80g,10,
"Mesa Com 6 Cadeiras Líbano 1,60 Cin/off White/crem - Ma",1.869,
Saboneteira Plástica Porta Sabonete Bebe Infantil Baby,10,
Kit Mini Lixa De Unha Canário 8cm Manicure Pedicure 20 Un,12,
Tênis Feminino Knit Bebecê,149,
Chuveiro elétrico de parede Lorenzetti Acqua Ultra Star branco 6800W 220V,279,(293)
Pegador De Macarrão Fun Cook 27 Cm - Home Style,25,
Tapete Peludo Pequeno Sala Cozinha Quarto Bem Vindo 60x40,28,(22)
Jogo De Copos De Cerveja Dresden 400 Ml 4 Peças,89,
Vassoura Gari Piaçava Nylon/ Madeira 40 Cm C/ Cabo,35,
Casaco Trench Coat Cor Sólida Feminino,221,
Faqueiro Glossy 24 Peças - Home Style,179,
Kit De Ganchos Organizadores Para Garagem Klatter,225,
Mesa Com 6 Cadeiras Siria Imbuia/preto/marrom - M.a,2.359,
Kit Cadence Red Fritadeira E Liquidificador Robust,809,
"Blush Cintilante - Glossy Blush 8,1g Océane",90,
Kit Com 2 Calças Malha Grossa Menina Wondrus,184,
Carregador Veicular + Cabo Dados Luxcar Android Micro B 12v,51,
Jogo Para Churrasco Polywood 2 Peças - Tramontina,139,
Colher Pedreiro Canto Reto 9 Pol Galo Aço Cabo Reforçado,33,
Sanduicheira Mini Gril Gourmet Antiaderente Ce09 Multilaser,129,(90)
Vaso De Planta Quadrado Plástico 30 X 36 Cm Bege Begônia,74,(4)
Jaqueta Casual Masculina,200,
Lima Triangular Delgada 7  L309-307 - Starrett,41,(6)
Máquina de costura reta Singer Patchwork 7285 portátil branca e cinza 127V,2.196,(96)
Kit 12 Toalhas Descartável Compacta Desidratada Multiuso,30,
Liquidificador Philco Plq125v Reverse Turbo 1200w,199,(4)
Limpa Telas Notebook Celular Tv Tablet Luxcar 100ml,24,
Lixa De Unha Canário Manicure Pedicure Resistente Kit Com 3,12,
Boneco Funko Pop Marvel Capitao America Vingadores 627,168,(14)
Casaco Grosso De Lã Com Capuz De Outono E Inverno,248,
Manta Líquida Protelha Plus 18 Litros Cor Branca,620,
Relógio Comparador Analógico 0-10mm 121.304 - Digimess,222,
Bomba De Ar Para Infláveis Vollo,53,
Escova Térmica Profissional Cerdas Resisntente Média 43mm,156,
Copo Cerveja Budweiser 400ml In Com,29,
Mochila Samsonite Move 3.0 Casual Camuflada Azul,700,
Cam Silk Mc Stencil,99,
Cadeira infantil para carro Fisher-Price Snugfix 360º cinza,1.649,(151)
Conversor De Mídia De Fibra Ethernet 1000m Sc Mmf 550m 2-pc,261,
Dispenser Day By Day 600 Ml Cz Com,34,
"Lixeira De Pia Flat 2,8l L Ptbg Com",59,
Suporte Para Papel Toalha Rose Gold Rg Com,59,
Cadeira Para Auto Akita 9-36 Kg Chicco,1.729,
Taça Martini Outdoor 320 Ml,17,
Filtro De Linha Universal 5 Tomadas Régua Extensão Chave Led,36,(17)
Escova De Cabelo Profissional Térmica Cerdas Mistas Meia Lua,92,
Taça Água E Vinho Outdoor 400 Ml,17,
Base Para Chuveiro Monocomando Deca 4493.000 3/4,321,
Mesa Tampo De Vidro Com 4 Cadeiras Santra Imb/capuccino - Ma,1.009,
Escada Doméstica Alumínio 05 Degraus Esc0064 Botafogo,204,
Escova De Desembaraçar E Pentear Cabelo Jacaré  Profissional,8,
Calvin Klein Ckin2u For Him - Edt 50ml Beleza Na Web,298,(119)
Sousplat Elisabeth 33 Cm - Home Style,35,
Tonalizante Coloratto Sem Amonia 10.2 Louro Platina Viol 60g,33,
Escova Térmica Cerdas De Nylon Profissional Santa Clara 18m,96,
Bolsa Organizadora Impermeável Luxcar,56,
Escova Profissional Térmica 18mm Cerdas Mistas Dupla Altura,95,
Soldadores Olhos Proteger Óculos De Roxo Din4-din11,80,
Relógio Feminino Technos Style Preto Original Com Nfe,377,
Cadeira infantil para carro Chicco Seat4fix preto,3.299,(10)
Mascara De Solda Automatica Auto Escurecimento C/ Esquadro,128,
Boneco Funko Pop Disney Pinoquio Jiminy Cricket Jimmy 1026,169,
Vaso De Planta Redondo Plástico 38 X 36 Cm Cinza Begônia,104,
Talco Vegetal Bons Tempos Lavanda Turma Da Monica Baby 200g,34,
Maquina Assentar Pisos Porcelanatos A Bateria Vonder Map120,965,
Creme Pentear Siàge Revela Os Cachos Restauraç Intensa 270ml,39,
Aditivo Protetivo Para Radiador Luxcar 1litro Arrefecimento,23,
Cadeira Gamer Giratória Trevalla Tl-cdg-06-5pr,565,(155)
Compressor de ar mini a bateria portátil Schulz 12V Automotriz Air Plus 12V preto,261,(331)
Kit Tapete Cozinha Passadeira Barra 3 Pçs Oferta Atenas,64,
Mochila Masculina Crossgear Notebook Funcional Espaçosa,189,
Fralda Descartável Infantil Mili Love & Care P Pacote 56 Unidades,49,(9)
Armário De Cozinha Mara 5 Peças Boreal/grafite - M.a,909,
Queijeira Vision 13cm Ixin Neu,59,
Roldana Elíptica Rotativa Cromada (par) D'addario Pwrep202,256,
Capacete De Segurança Branco Com Catraca H700 - 3m,100,
Calça Feminina Basica Polo Wear Jeans Médio 013001050300,99,
Cadeira Para Carro Artemis 360 Multikids Baby 0 A 36kg,1.499,
Kit De 148 Ferramentas Com Chaves Combinadas + Paquímetro,248,
Lâmpadas Led Inteligente Wifi Ajustável Multicolor 12w 3pcs,146,
Carrinho Coloração Auxiliar Salão Mesa Para Tintura Multiuso,368,
Touca Térmica Metalizada Elétrica Tratamentos Para O Cabelo,83,
Alicate P/ Anéis Ponta Chata 7 44010/170 Tramontina,63,
Vaso De Planta Redondo Plástico 38 X 36 Cm Bege Begônia,104,
Respirador Descartável Branco C/válvula Pff2 8822 - 3m,21,
Mesa De Centro Industrial 3 Em 1 Begônia,645,
Controle joystick sem fio Sony PlayStation Dualshock 4 jet black,399,(10656)
Luz De Trabalho Portátil 500lm 9 Luzes Led Klatter,99,
Auto Elimina Riscos 120g Hb004330682 - 3m,47,
Cadeira infantil para carro Fisher-Price Snugfix 360º preto e cinza,1.649,(151)
Jaqueta Infantil Menino Em Sarja Hering Kids,199,
Aquecedor Versátil Lorenzetti 3t 220v/5500w Branco,254,(2474)
Casaco Acolchoado Térmico Com Capuz De Inverno Feminino,217,
Disco De Lixa Flap Gr80 7 X 7/8  - Bosch,21,
Pente Separador De Mechas Cabo Fino Pa Divisão Salão Beleza,14,
Kit Mini Lixa De Unha Colorida 8cm Manicure Pedicure 20 Und,12,
Jaqueta New Balance Athletics Masculina,469,
Cadeira Gamer Pctop Deluxe Vermelha -x-2521,1.179,
Bolsa Feminina Tiracolo Transversal Multineutro Anacapri,229,
Carrinho Auxiliar Cabeleireiro Estética 4 Gavetas P/ Secador,339,
Calças Masculinas De Trabalho Das Forças Especiais Ix9,216,
Esquadro Em Aço Para Carpinteiro 24x16 45-600 - Stanley,105,
"Kit Grill Inox E Cafeteira Com Jarra Inox 0,7l Oster",649,
"Balde De Gelo Fiesta 7,5 L",89,
Blusa Feminina Quadriculada Manga Balão Longa,79,
Fita Adesiva Dupla Face 19mm X 20m Vhb 4910 - 3m,103,(2401)
Esponja De Microfibra Lava Seca Polir Carro Luxcar,32,
"1000base-t 1,25g Sfp-t Cobre 100m Para Cisco Glc-t/sfp-ge-t",146,
Máscara De Solda Profissional Com Regulagem + Óculos,188,
Robô aspirador e passa pano Wap Robot W100  preto 127V/220V,729,(1268)
Kit Esmerilhadeira 900w E Furadeira De Impacto 570w + Brocas,498,
Proteção De Dados Pessoais Do Id Do Protetor De Azul,79,
Vaso De Planta Redondo Plástico 38 X 36 Cm Preto Begônia,130,
Gerador De Vapor Para Sauna 9kw Inox Sodramar Para 10m³,2.790,
Tapetes 60x40 Peludo Felpudo 4cms Quarto Ou Porta!! Atacado,23,(27)
Máscara Cabeça De Porco Ghost Slayer Anime Cosplay,158,
Colchao De Espuma Solteiro Luuna Blue 88 X 188 X 20cm,3.199,
4 Manta Lisa Soft Pet Cachorro Gato Estampadas Oferta,47,(13)
Luminária De Mesa Luz Noturna 3d Avengers De 7 Cores,108,
