name,preco,avaliacao
Ar Condicionado Split Hw LG Dual Inver Compact 12k Frio 220v,2.127,
Kit Lixa Unha Canário 16 Cm Manicure Pedicure 6 Unidades,12,
"Porta-escova Square 7,6 Cm X 10,5 Cm - Home Style",15,
Guincho Elétrico Tec 100/200kg 12m 220v Csm Uso Intermitente,1.100,
Escova Cabelo Térmica 43mm Cerdas Dupla Altura Profissional,139,
"Panela De Pressão Clock Prata 4,5l Polida",137,
Vinilo Decorativo Rama De Arbol Pajaro De Casa,80,
"Bomba Submersível Schneider Brava E20 2,0cv 220v Trifásica",3.894,
Lavadora de alta pressão Kärcher Uso Intensivo HD 585 Prof S cinza e preta com 2176psi de pressão máxima 220V,3.173,(294)
Placa De Rede Nic 1.25g Dupla Rj-45 Com Chip Intel 82591,209,
Furadeira martelete sem fio de 13mm Makita DHP482SY 18V + acessórios,1.149,(520)
Lâmina Para Serra Tico Tico De Bancada B-07515 - Makita,76,(4)
Taça Para Água Titânio 550 Ml - Bohemia,39,
"Ventilador de parede Ventisol Monta Fácil turbo preto com 6 pás, 51 cm de diâmetro 127 V",358,(113)
Condicionador Cachinhos Mais Definidos Turma Da Monica 200ml,25,
Cabo De Remendo De Fibra Os3 Lc Para Lc Multimodo 1m 4pcs,140,
Porta Pivotante De Alumínio Branco 210x100 Linha 25 Completa,1.383,
Ventilador De Teto Ventisol Fênix Inverter Controle - Bivolt,518,
Reloj De Pared Decoração De Diamantes Criativo De Hogar 3d,197,
Tênis Feminino Favo Preto Mali Aquarela Kolosh,139,
Porta Papel Higiênico De Piso Duplo Iquê Pingoo.casa - Prata,289,
Fluido Engrossador De Fios Haskell Encorpa Cabelo De 120ml,37,(21)
Luz De Trabalho Portátil 500lm 1 Luz Led Klatter,143,
Tonalizante Coloratto Sem Amonia 3.0 Castanho Escuro 60g,33,
Luva De Boxe Training 14 Oz Preta Vollo,279,
"Papel De Parede Listrado Champagne Bege 9,5mx52cm Begônia",129,
Grampo Tipo C Ferro Fundido N 6'' 150mm Gc034 Metalsul,69,(8)
Sousplat Pearl Verde 32 Cm  Wolff,120,
Conjunto De Cosplay Moonlight Knight Adultos E Crianças,211,
Boia De Braço 15 X 25 Cm Vollo,19,
Toalha De Banho Mellis 135x70cm Ro Com,45,
Boneco Funko Pop Movies Wanda Vision 70s 718 Marvel Comics,209,
Fio Cabo Elétrico 10mm Colorido Com 100 Metros,619,(39)
Grampo Sargento Tipo C 4'' 100mm 206565 10 Unidades Sparta,299,(5)
"Cadeira, booster Fisher-Price Safemax 2.0 preto",949,(89)
Faqueiro Posh 36 Peças - Home Style,519,
Torneira Misturador Banheiro Com Duplo Comando In04,605,(22)
Camiseta Malha Sport Logo - adidas,119,
Lavadora de alta pressão Tramontina Residencial Master 42550 amarela e preta com 110bar de pressão máxima 127V,1.247,(23)
Camisa Entrada 18,119,
Kit 1000 Buchas Oca C/ Anel 5mm Tijolo Bloco Parede,22,
Caixa De Vareta Alumínio Tig Er4043 4mm C/ 10kgs,794,
Escova Profissional Térmica Meia Lua Com Cerdas Mistas,92,
Skate Vsb001 Vollo Vollo,335,
Escorredor De Louça Bambu 43 Cm X 33 Cm - Home Style,102,
Planet Nova Deluxe Inox Vermelho,699,(71)
Kit Disco De Lixa Roquite 6 C/ Furo #80 / #150 / #320,295,
Temporizador Timer Digital Lcd Programável Tomada Bivolt,78,
Grampo Tipo C Ferro Fundido N 6'' 150mm Gc034 Metalsul,65,(8)
Luva Manopla De Foco Vollo Vollo,279,
Coloração Itallian Color  6.3 (26) Louro Escuro Dourado,30,
"Caixa Organizadora Fit Ultra 38x31,5 Cm Vd Com",69,
Cinta Para Amarração Com Catraca Luxcar 5 Metros,51,
Anel Plastico Reservatório Henna Batoque Micropigmentação,10,
Bomba periférica Eletroplas ICS50AB 0.5cv azul 60Hz 110V/220V,280,(82)
Coloração Itallian Color  5.17 Castanho Claro Marrom Frio,30,
Kit Red Cafeteira 2day E Torradeira Oster,629,
Mochila Preta Spector Whats Original Masculina Resistente,179,(61)
Escova De Cabelo Profissional Térmica Cerdas Naturais 33mm,138,
Bomba / Pressurizador Tpli-70 Tc-18 1/2cv 220v - Texius,1.848,
Serra Tico-tico Sem Fio 20v 2400rpm Klatter,503,
Escova De Cabelo Profissional Térmica Cerdas Naturais 30mm,138,
Aparelho De Fondue Aspen Vermelho 8 Peças 1 Litro - Forma,199,
Mochila Bolsa Lequeen Dândi Smart Bebê Multifuncional Moda,229,(7)
Disco Diamantado P/ Esmerilhadeira 115mm - Bosch,43,
Balde Gelo Black Gold 5 L   29 X 29 X 19 Cm,119,
Kit Lixa De Unha Canário Manicure Pedicure 6 Unidades,12,
Chinelo Kids Times Estampa Degradê Fluminense Neorubber,59,
Pulseira Magnética P/ Fixar Itens Metálicos 115649 Mtx,25,
Jogo De Panelas Al Forjada Reverse Indução 5 Peças - Neoflam,1.399,
Sousplat Pearl Rosa 32 Cm - Wolff,127,
Jogo Para Queijo Veneto 8 Peças - Haüskraft,99,
Escorredor De Louça Flat 42 Cm - Coza,139,
Faqueiro Haus Branco 24 Peças,249,
Parafusadeira Chave Impacto 1/2 S/bateria Dcf889b Dewalt,1.289,
Capa Para Cobrir Moto Impermeável Leve E Resistente Luxcar,56,
Controle Inalámbrico Ps4 Compatível Com Sony Playstation 4,182,
Lâmpada De Controle Táctil De Noche Mesa Com Luz 7 Cores Led,121,
Serra Circular 7.1/4'' 185mm 1400w 5402 Skil + Guia + Disco,689,
Pente Separador De Mechas Cabo Fino Pa Divisão Salão Beleza,14,
Prato Sobremesa Mudra - Home Style,29,
"Papel De Parede Geométrico Infantil 9,5mx52cm Begônia",247,
Auxiliar Partida Compressor 12v 500a Biv Js500s Black+decker,999,
Kit Chuveiro Teto Inox 304 Slim 40 Cm + Braço 25 Cm Mundaú,544,
Base Magnetica Articulado E Ajuste Fino 270.240b Digimes,560,
Batedeira com pedestal Oster OBAT912 cinza 220 V,1.899,
Lavadora de alta pressão Vonder Leve LAV 1800 com 140bar de pressão máxima 220V,1.553,(128)
Camiseta Menino Wondrus,63,
Torradeira Oster Inox Simple Life,269,(4)
"Lixeira De Pia Trium 2,5 L - Ou",49,
Skate Vsb001 Vollo Vollo,335,
Chinelo Feminino Trancoso Hibisco Ramarim,69,
Porta Shampoo Banheiro Alumínio Duplo Canto Piquiri - Preto,164,(20)
Calça Cargo Masculina Special Forces,233,
Peneira Inox Resistente C/ganchos 21 Cm 5664 Ap21 Mimo Style,18,
Escova Profissional Térmica 25mm Cerdas De Nylon Resistente,102,
Jaqueta De Inverno Masculina Light Down Jacket,209,
Kit Aspirador Robô Oster Keep Clean Blue Com Mop,1.798,
Cuscuzeiro Extra 18 Cm Alumínio Polido 560 Oliveira,45,
Kit Lixa De Unha Big Preta Manicure Pedicure 3 Unidades,12,
"Vaso De Planta Pilão Plástico 38,0 X 34,5 Cm Bege Begônia",97,
Serra Tico Tico 400 Watts St400 Hammer 220v,158,
Luz De Trabalho Portátil 1000lm Led Recarregável Klatter,265,
Bota Cano Longo Napa Lezard Vizzano,259,
Climatizador De Ar Ventisol 35 Litros Pro 220v Clin35,1.698,
Bola Para Atividades Aquáticas Em Piscinas E Praias Tam. 20,29,
Coberdrom Edredom Pele De Carneiro Casal Queen  Sherpa,239,(21)
Pá De Areia Para Detectorismo 100% Inox 304 -modelo Portátil,422,
"Piso Vinílico Sensofloor 2mm : Branco Royal 3,9m2/cx",268,
Disco De Corte A30rb32 16 X 3/16  X 1  - Icder,45,
"Porta-escova Berry 7 Cm X 10,7 Cm - Home Style",59,
"Prato Fundo Emily 23,5 - Home Style",39,
Capa Dealmofada Alma Lumi 45 X 45 Cm - Home Style,71,
Mochila Samsonite Yourban Casual Azul,850,
Parafusadeira Imp Bateria 18v Gsb180li Bosch + 23 Acessórios,983,
Papel Depilatorio Tnt Falso Tecido 50 Unidades Depilação,19,
Pano Em Microfibra Conjunto Com 4 Luxcar,28,
Chinelo Baby Times Estampa Manto Fluminense Neorubber,59,
Escova Circular Aço Carbono 06'' 04946 Titanium,29,
Kit Lixa De Unha Canário Manicure Pedicure 12 Unidades,7,
Navalhete Profissional Navalha Retrátil Barbear Cabo Madeira,38,
Ampola Vidro De Reposição C2 P/garrafa 500 Ml 50748 Termolar,35,
Jogo Utensílios Bambus 4 Peças - Home Style,29,
Limpador Kasão Limpa-Vidro em galão 5l,64,
Sandália Rasteira Feminina Tiras Com Detalhe Preto Beira Rio,89,(7)
Kit 2 Peças Cropped Volare,69,
Lixa De Unhas Parda Grande Manicure Pedicure Profissional,12,
20 Envelopes Para Esterilização Alicate Cutícula 9 Cm X 24cm,22,
Moletom Menino Com Capuz Malha Wondrus,79,
Calça Jeans Wondrus,147,
Boardshort Masculino Estampado Polo Wear,79,
Refletor Led Slim 10w Luz Verde Bivolt Mini Holofote,36,(129)
Bigodim Bigodinho Circular Nº3 Kit Com 12 Unidades,37,
Prateleira De Madeira Com Suporte Branco 50x18cm Begônia,129,
Chinelo California Vibes Infantil Ipanema,29,
Escova Profissional Térmica Cabelo 30mm Cerdas Mistas 180g,111,
Chinelo Masculino Slide Full 86 Preto Rider,59,
Capa Protetora Colchão Ajustável King Mercado Livre Basics,129,(13)
2 Esquadro Magnético Robusto 12kg Titanium + Alicate Pressão,58,(5)
Kit Cozinha Tapete Passadeira Barra 3 Pçs Oferta Asteca,64,(8)
Escova Profissional Térmica 43mm Cerdas Mistas Dupla Altura,120,
Kit 6 Lâmpada 15w Bulbo Soquete E27 Bivolt Casa Comércio,83,(99)
Inox Espatula Cortador Raspador Massa Legumes Chocolates,25,(4)
"Papel De Parede Flores Infantil Rosa 9,5mx52cm Begônia",182,
"Tapete Kids 1,5x1 Antiderrapante Belga Kids Estampado",75,
Presskit 6 Esmaltes Infantil Impala Encanto Disney + Bolsa,105,
Picador De Ajo Verduras Presionando Cortador Alimento A Mano,97,
Rolo Para Esterelização Alicate Cuticula 7cmx 100m Manicure,157,
Calça Feminina Jeans Médio Polo Wear,99,
Casaco Feminino Básico Com Barra Arredondada Hering,99,(93)
Chinelo Feminino Ilheus Preto Ramarim,79,
Calça Jogger Bebê Malha Grossa Wondrus,88,
Suporte P/ Furadeira Esmerilhadeira +30 Disco Lixa 125mm,42,(61)
Prateleira Assimétrica Madeira Suporte Preto 60x10cm Begônia,139,(4)
Calça Feminina Skinny Jeans Escuro Polo Wear,99,
Camiseta Masculina Indie Gola V Basic King 2 Cavalera,149,
02 Pilhas Bateria 9v Comum Zinco E Carbono 6f22,14,
"Papel De Parede Floral Cinza 9,5mx52cm Begônia",129,
Panelinha Aquecedora De Cera Termocera Mega Bell+ Refil 200g,328,
Tênis Feminino Alfa 124 Chumbo Olympikus,199,
Bota Feminino Coturno Salto Médio Ramarim,229,
Conjunto Fondue Cerâmica 10 Peças 1256/103 Brinox + 4 Velas,154,
Microfone De Mão Sem Fio Profissional Ntbd-pro Ew135g4,183,
Pente Garfo Penteado De Cabelos Afro Dentes Aço,27,
Sandália Feminina Slim Pride Rainbow Havaianas,74,
Lustre Pendente De Teto Meia Bola Alumínio Cinza Begônia,99,(11)
Xícara De Café Mudra 110 Ml - Home Style,29,
Chuteira Artilheira V Society adidas,249,
Lixadeira Orbital Com Coletor De Pó 240w Klatter,349,
Lustre Pendente Industrial Em Alumínio 50x15cm Begônia,239,
Adaptador Usb Wifi 6 Ax1800 Usb3.0 Banda Dupla 2.4/5ghz,222,
Guarda Sol Gigante Para Piscina Praia Articulado,228,
Pedicuro Para Lixar Pé E Tirar Calo Profissional + 12 Lixas,399,
Cafeteira Tres Corações Passione automática preta-brilhante para cápsulas monodose 220V,649,(186)
Tênis Swift 3 968 Violeta Olympikus,249,(176)
Mesa Lateral Com Revisteiro Marrom Begônia,350,
Coloraçao Itallian Color Professional 8.0 Louro Claro 60g,30,
Mochila Bolsa Maternidade Reforçada Wondrus,250,
Kit Tapete Cozinha Passadeira Barra 3 Pçs Oferta Egito,64,(8)
Tênis Ciranda Cinza Claro Preto Cacharel Kolosh,109,
Disco sólido interno Multilaser AXIS 500 SS100 120GB preto,140,(105)
Dosador De Acetona Com Porta Algodão Kit Pedicure E Manicure,29,
Fraldas Huggies Tripla Proteção M 92 u,99,(1235)
Jogo De Ferramentas Manuais Com 10 Peças Klatter,266,
Relógio Technos Masculino Performer Racer,339,(94)
Furadeira Parafusadeira Bateria + Jogo Ferramentas 300 Peças,278,(43)
Calibrador Digital De Pressão P Pneus Cd 500 - Vonder,116,(16)
Kit Alongamentos Unha Gel Fibra Produtos Decorativos Cabine,239,(31)
Mala Pequena De Bordo Zug Swiss Move Azul,300,(29)
Kit 20 Spot Led Smd 7w Dicróica Direcionável Quadrado Forte,195,(79)
Kit De 3 Calça Plus Size Jeans Feminina Cintura Alta C/lycra,199,(533)
"Tapete Sala 1,50x2,00 Peludo Shaggy Macio  + Brinde.",99,(55523)
Notebook Tablet 2 Em 1 Mm11w Prime Celeron 4gb 64gb W,1.488,(52)
Kit Cuba Pia Aço Inox Gourmet Nw Cozinha Acessórios Simples,309,(99)
Guarda-roupa Solteiro Madesa Denver 2 Portas Correr Espelho,849,(409)
Kit Com 10 Cuecas Masculina Boxer Sortida Lupo,393,(325)
Kit Social Completo Paleto+calca+colete+camisa+gravata*,275,(305)
Sinusite Higienizador Ducha Nasal Lavador Lavagem  - 300ml,39,(288)
Kit Som Automotivo Bluetooth Auto Falante Bravox 6 + 6x9 69,299,(6407)
Pinador Pneumatico Para Pinos De 10 A 50mm Mtx Profissional,198,(802)
Cadeira Escritório Presidente Molas Ensacadas Pillow Top,1.225,(15)
Tapete Capacho 120x60 Personalizado Logomarca Empresa Loja,131,(52)
Notebook Hp Intel Core I5 6 Ger 8gb 240gb Ssd - Vitrine,2.899,(5)
Tênis Delicate 4  Chumbo E Hibisco Olympikus,199,
Caixa Térmica Cooler Com Alça Praia Pesca Camping,69,(6)
Tricot Canguru Com Touca Infantil Wondrus,79,
Tênis Feminino Index 2 Olympikus,179,(37)
Assento Tampa Vaso Oval Almofadado Várias Cores Astra Color,129,(47)
Sifão Sanfonado + Engate Flexível 40cm + Válvula Lavatório,45,(18)
Bota Feminina Cano Alto Napa Floather Preto Beira Rio,239,
Fone De Ouvido Headset Gamer Luz Led Rgb Pro Usb 7.1 Tedge,315,(31)
Temporizador Timer Mecanico Analógico Bivolt Bomba Piscina,43,(36)
Esmerilhadeira angular Klatter YSAG01 de 50 Hz verde e preta 840 W 220 V + acessórios,279,(82)
Calça Jeans Lycra Feminina Skinny Jeans.com,124,
Mesa Dobrável E Portátil De Alumínio Klatter,224,(30)
Sweet Grow Vitamina Para Cabelos E Unhas 180 Dias,179,
Fralda Descartável Infantil Mili Love & Care M Pacote 52 Unidades,49,(20)
Tênis Feminino Rushy Preto Olympikus,229,
Coberdrom Sherpa Casal Queen Edredom Pele De Carneiro,239,(61)
Kit 2 Blusas Femininas Com Detalhe Na Manga Volare,78,(16)
Pijama Longo Feminino Malha Adulto Manga Comprida,52,(53)
Torneira de cozinha monocomando Doan Metal NOX01 acabamento escovado polido,45,(242)
Camiseta Masculina Silk Mc Logo Hang Loose,89,
Blusa Masculina Moletom Com Bolso Canguru Essential Rusty,269,
Difusor De Aromas Óleos Essenciais Umidificador Ultrassónico,122,(23)
Jumbo Super X Cabelo Para Tranças Jumbão Box Braids 400 Gr,36,(15)
Caixa Coletora De Gordura Com Cesto Standard - Metasul,150,(8)
Blusa Moletom Manga Longa Gola Careca Single Stone Volcom,289,
Mochila Reforçada Heritage Mercado Livre Basics,190,(4)
Torno De Bancada Aço Base Fixa Mini Morsa 75mm - Sparta,39,(760)
Mangueira Antitorção Multi Ats 1/2  Tramontina Pvc 20m,182,
Chaleira elétrica Oster OCEL704 transparente 220V 1.8L,289,(102)
Elástico Rabico Para Cabelo Tipo Meia Pacote 72 Un. Xuxinha,19,(257)
Carrinho Porta Esmaltes Organizador Expositor Salão Manicure,299,
The Legend of Zelda: Breath of the Wild Standard Edition Nintendo Switch  Físico,364,(328)
Relógio Champion Feminino Couro Preto Ou Marrom + Kit Brinde,189,(55)
Camiseta Masculina Logo Básico Peito Branca Calvin Klein,149,
"Passadeira Quarto Sala Felpudo 1,00 X 0,55",38,(55523)
Tênis Feminino Favo Preto Mali Preto Blush Kolosh,109,
Liquidificador Oster 1400 Full OLIQ610 3.2 L preto com jarra de plástico 220V,299,(956)
Mesa Lateral Com Revisteiro Marrom Begônia,310,
Conjunto De Panelas Polidas 3mm 6 Peças Begônia,499,
Moletom Masculino Bolso Canguru Estampado Hang Loose,299,
Alicate Crimpador P/terminais Rj11/rj12/rj45 - Tramontina,315,
Torneira Banheiro Monocomando Misturador Girar 360°,259,(5)
Blusa Moletom Hoodie Washed Reserva,389,
Torneira De Jardim E Tanque Metal Maquina De Lavar Preta C70,56,(4)
Pneu Continental VanContact AP C 205/70R15 106/104 R,849,(20)
Sandália Feminina Slim Tropical Havaianas,49,
Removedor De Ceras 5 Litros Casa Km,58,(11)
Plaina elétrica manual Bosch Professional GHO 700 82mm 220V azul,949,(404)
Kit Com 2 Calças Para Bebê Rosa Wondrus,143,
Casaco De Tricot Menina Bolso Com Ursinho Wondrus,136,
Suporte Fixo Para Tv De Parede 14'' A 84'' Preto Tedge,29,(6)
Painel Plafon Led 24w Quadrado Embutir Branco Neutro,59,
Pote Quad Cloc Glass My Storage 320mlin Com,25,
Prateleira Industrial De Madeira Com Suporte 60x18cm Begônia,149,
Kit Cozinha Passadeira Barra 3 Pçs Oferta Maya,64,(8)
Bermuda Feminina Classic Joy Cinza Rainha,79,(10)
Chinelo Kids Disney Mickey Vermelho Rubi Havaianas,29,(174)
Torneira de cozinha monocomando Baccani Gourmet 50 Cm acabamento cromo,339,(313)
Calça Jeans Infantil Menino Hering Kids,139,
Torneira Banheiro Cascata Baixa Quadrada Monocomando Paraná,196,(46)
Camisete Feminino Alças Finas Sem Costura Hering,69,
Capa Protetora Cão Gato Petcar Banco Traseiro  Impermeável,78,
Chinelo Feminino Slide Bt21 Estampado Ipanema,49,(4)
Calça Legging Feminino Adulto Mescla Escuro Basicamente,69,(4)
Capa Protetora Colchão Queen Ajustável Mercado Livre Basics,79,(78)
Pc Desktop Fácil Gamer I5 16gb Geforce 2gb Ssd 240gb Hdmi,2.149,(4)
Calça Jeans Lycra Skinny Cigarrete Bigode Jeans.com,124,
Computador Completo Fácil Intel I5 08 Gb Ddr3 Ssd 120 Gb,2.009,(4)
Bolsa Esportiva 20 Kg Preto Mizu,249,
Camisa Logo Pequeno,119,
Chinelo Feminino Exuberance Ipanema,34,
Sandália Feminina Salto Agulha Verniz Bege Vizzano,119,(19)
Bola De Futsal F3 Brasil Oficial Sub 11 Kagiva,119,(9)
Camiseta Masculina Silk O & O Outline Hurley,119,
Tênis Feminino Mali Fibra Cacharel Creme Kolosh,129,
Banquinho De Cócoras Apoio De Pé P/ Fazer Coco Vaso Sanitari,77,(21)
Sandália Infantil Baby Shark Fun Ipanema,34,(5)
Bolsa De Tanque Para Moto Impermeável 3 Litros Tedge,199,(85)
Camisa Jeans Feminina Oversized Hering,179,
Kit Botik Ácido Hialurônico + Vitamina B5 (3 Itens),99,(31)
Bola Futsal Star Costurada Kagiva,139,
Moletom Com Zíper Menino Wondrus,140,
Tênis Feminino Com Aplicações Metalizadas Branco Vizzano,139,(5)
Papel Higiênico Folha Simples Com 32 Rolos De 60m Mili,39,(63)
Fraldas Capricho Baby Hiper 5 Tamanhos Toque Macio,39,
Camiseta Polo Infantil Manga Curta Com Bordado Wondrus,107,
Mocassim Feminino Detalhe Em Corrente Anacapri,159,
Kit Com 2 Banquetas Dobráveis Em Aço E Com Estofado Begônia,129,(9)
Camiseta Masculina Indie Deusa Velocidade Cavalera,169,
"Disco De Corte Fino Inox 4.1/2 X 1,0 Esmerilhadeira 50 Pçs",112,
Mesa De Cabeceira Madesa 3227 2 Gavetas Com Espelho,299,
Cimento Queimado Cor Mineral 5kg Portokoll,78,
Escrivaninha Mesa Office Em L Estilo Industrial,342,
Mochila Bolsa Infantil Criança Diversos Desenhos Wondrus,200,(84)
Kit Tapete Cozinha Passadeira Barra 3 Pçs Oferta  Marrocos,64,(13)
Prateleira De Madeira Com Suporte Preto 60x18cm Begônia,99,(4)
Tênis Qt Racer 3.0 adidas,379,
Cadeira De Escritório Tulipa Com Altura Ajustável Begônia,460,
Kit Pedreiro Gesseiro Giz Para Marcação,19,
Tênis Casual Pelica Verniz Vizzano,149,
Disco De Serra 300mm 80d P/ Madeira Dwa03150 Dewalt,399,
Adesivo Cola P/ Ferro Concreto Sikadur Epoxi - 1kg,98,
Chaleira Com Apito Inox E Alça Bambu 3l Aj19228 Mimo Style,159,
Fio Cabo Flexvel 6mm 100 Metros Cores Cobrecom,819,
Kit Para Banheiro Splash Com Tampa 2 Peças Coza 99182 Brinox,35,(65)
Broca Bailarina Ajustável 30-120mm P/ Madeira Gesso Plastico,32,(11)
Torneira Clinica Hospitalar Mesa Alavanca Cotovelo Metal,119,(5)
Adaptador Soquete Redução 1/4 3/8 1/2 Cr-v,90,(4)
Kit Cuba De Vidro + Tampo 60 + Suporte + Torneira + Válvula,570,(64)
Aspirador de pó Multilaser HO06 vermelho 127V,199,(252)
Furadeira Parafusadeira Sem Fio 20v 1300rpm Klatter,306,
Chinelo Masculino Coleção Times Flamengo Degradê Neorubber,69,(4)
Interruptor Touch 2 Botões + Tomada Wi-fi Inteligente Br,219,
Máscara Capilar Siàge Cauterização Dos Fios 250g,52,(38)
Camiseta Masculina Silk Manga Curta Hawaii Hang Loose,99,
Mochila Bolsa Reforçada Moderna Mercado Livre Basics,350,
Mop Spin 360° Com Esfregão Em Microfibra 12 Litros Condor,129,(14)
Jogo Serra Copo Encanador Ezychange 19-57mm 8 Pçs Makita,764,
Esmerilhadeira angular Klatter YSAG01 de 60 Hz verde e preta 840 W 127 V + acessórios,279,(82)
Mochila Kings Sneakers Monkey Espaçosa Original Top Preta,139,
Kit Bomba Dágua 12v + Placa Solar 60w + Controlador+ Bateria,929,
Camiseta Estampada Bolso R Reserva,189,
Tênis Feminino Flit 2 991 Chumbo E Hibisco Olympikus,229,
Vaso Sanitário Monobloco Branco Harmony 8095 - Oferta,1.129,(32)
Balde 50 Litros Para Guincho De Coluna Menegotti,538,
Samsung Galaxy A32 Dual SIM 128 GB violeta 4 GB RAM,2.399,(3624)
Espaçador Nivelador Piso Porcelanato Slim 1000pçs+100cunhas,178,(9)
Porta Pivotante De Alumínio Branco 210x100 L25 Friso E Vidro,1.383,
Micro-ondas Panasonic NN-ST55LMRU   prata 27L 127V,749,(281)
Parafusadeira Chave Impacto 12v Biv 2 Baterias Dcf813 Dewalt,1.345,
Shorts Aeroready Essentials Chelsea 3-stripes - adidas,179,
Brinquedo Eletrônico Interativo Para Gato Crazy Donuts Mimo,299,
Moto G22 Dual SIM 128 GB cosmic black 4 GB RAM,1.349,(500)
Bomba Submersa Leão 1cv 220v 3 Polegadas (caneta) C/ 2 Fios,1.315,(8)
Microsoft Xbox Series S 512GB Standard cor  branco,2.499,(1157)
Kit Masculino Relógio Militar Prata + Carteira Condor,185,
Relógio Champion Ana Hickmann Feminino Couro Digital,819,
"Notebook Acer Aspire 5 A515-54 prata 15.6"", Intel Core i5 10210U  8GB de RAM 256GB SSD, Intel UHD Graphics 620 60 Hz 1920x1080px Windows 11 Home",3.799,(74)
Torneira Monocomando De Parede Com Misturador Klatter,279,(20)
Samsung Galaxy M23 5G 128 GB orange copper 6 GB RAM,1.999,(272)
Base Cama King Cinza Luuna Mérida 193 X 203cm,3.199,
Smartwatch Iwo W27 Pro Série 7 Lançamento 2022 Original C/nf,299,(479)
Disco sólido interno Kingston SA400S37/240G 240GB preto,197,(11503)
Impressora Multifuncional Epson Ecotank L3250 Wi-fi Wireless,1.499,(2708)
Módulo Amplificador Stetsom Ir 400.4 400w Rms 4 Canais Novo,249,(2447)
Impressora a cor multifuncional HP Ink Tank Wireless 416 com wifi preta 100V/240V,1.599,(1376)
"Smart TV TCL S40-Series 40S615 LED Full HD 40"" 100V/240V",2.349,(152)
Fritadeira Sem Óleo Mondial Afn-50 Premium Line Inox 5l 110v,659,
"Monitor Concórdia Gamer R200s 23.8 Full Hd, 165hz, Freesync",1.018,
Moto G31 Dual SIM 128 GB grafite 4 GB RAM,2.199,(158)
Caneta Pencil Wb Compatível C/ iPad Com Palm Rejection 1.0mm,229,(654)
Cadeira De Escritório Preta Diretor Bob Travel Max,541,(25)
Ar condicionado Consul  split  frio 9000 BTU  branco 220V CBN09C|CBO09C,1.499,(668)
Smart Tv Philco 32'' Pol. Led Hd Hdmi Usb C/ Receptor Bivolt,1.999,(701)
Alto-falante Multilaser SP314 portátil com bluetooth preto 127V/220V,257,(591)
Impressora Termica Nao Fiscal Epson Tm T20 Usb Guilhotina,699,(22)
Placa de vídeo Nvidia Galax  GeForce RTX 20 Series RTX 2060 SUPER 26ISL6HP68LD 8GB,3.499,(13)
Kit Universal 50 Brocas Para Furadeira/parafusadeira Klatter,159,
"Smart TV TCL 43P615 LED 4K 43"" 100V/240V",2.799,(227)
Kit 4 Câmeras Intelbras 1120b Dvr 4 Canais Com Hd Completo,1.269,(138)
Aspirador de pó Wap GTW 10 10L amarelo e preto 127V,499,(3675)
Plafon Embutir Painel Led Slim 60x60 50w Quadrado Frio 6000k,198,(22)
Câmera Segurança Ip Wifi Auto Tracking Audio Infravermelho,228,(1041)
Estante Livro Painel Tv 43 32 42 50 52 Polegadas Quarto Sala,259,(243)
Módulo Taramps Ds800x4 800w Rms 2 Ohms Ds800 Amplificador,527,(1666)
Kit Bota Masculina Adventure Carteira Cinto Chinelo Top!!!,145,(1114)
Bicicleta Aro29 Shimano Alumínio Gts Pro M5 Urban À Disco,1.349,(122)
Torneira Com Filtro Gourmet Pia Cozinha De Parede Metal Inox,139,(3107)
Samsung Galaxy M13 Dual SIM 128 GB verde 4 GB RAM,1.699,(31)
Notebook Samsung Np550xda-kp7br Celeron 4gb 128gb Ssd W11pro,3.299,(119)
"Notebook Positivo Motion Q4128C dourada 14.1"", Intel Atom Z8350  4GB de RAM 128GB SSD, Intel HD Graphics (Cherry Trail) 1366x768px Windows 10 Home",2.699,(512)
Câmera Inteligente Intelbras Ime 360 Segurança Wi-fi Full Hd,519,(153)
"Smart TV Multilaser TL020 DLED HD 32"" 100V/240V",1.631,(677)
Transformador 1500va-110 Para 220v E 220 Para 110v-kf 1000w,139,(39)
Smartphone Philco Hit P10 Dual Sim 128gb Rose 4gb Ram,1.299,(1657)
Ar condicionado LG Dual Inverter Voice  split  frio 18000 BTU  branco 220V S4-Q18KL31A,3.844,(173)
Multilaser F Dual SIM 32 GB café 1 GB RAM,479,(2012)
Monitor Concórdia Gamer Curvo Cz236f 23.6 Full Hd Hdmi Vga,896,
Pneu Iris Ecoris P 175/70R13 82 T,306,(48)
Maquina Acabamento Detalhe Barba Pelos Corpo Dragon Original,136,(255)
Samsung Galaxy A51 Dual SIM 128 GB prism crush black 4 GB RAM,2.699,(2313)
"Cabo Flexível 2,5mm Rolo 100m Metros Fio Elétrico C/ Inmetro",120,(465)
Bicicleta ergométrica WCT Fitness 10100019 para spinning preta e amarela,2.199,(132)
Central Multimídia Universal Mp5 2 Din Câmera Ré Espelham.,333,(1511)
"Monitor gamer LG UltraWide 29WK600 led 29 "" branco e preto 100V/240V",2.099,(280)
Smartphone Galaxy A13 Tela 6.6 128 Gb 4 Gb Ram Azul Samsung,1.599,(745)
Colchão Solteiro de espuma Ortobom Physical Iso 100 D33 grafite - 78cm x 188cm x 18cm,430,(283)
Fritadeira Elétrica Sem Óleo Multilaser Air Fryer 4l 127v,449,(452)
Cadeira de escritório Travel Max MB-6010  preta com estofado de tecido,449,(416)
"Tapete De Sala Antiderrapante Genova 1,32m X 2,50m Premium",208,
Samsung Galaxy M31 Dual SIM 128 GB azul 6 GB RAM,2.399,(2285)
Carregador De Pilhas Recarregáveis Duracell Aa/aaa Com 4 Aa,210,(979)
Fechadura Eletrônica Digital  Fr 101 Intelbras Touch Screen,519,(51)
Fogão cooktop gás Itatiaia NG 4 Bocas preto 127V/220V,509,(534)
Bicicleta Alum 29 Ksw Gta 27 Vel Freio Disco Hidrául E Trava,2.199,(57)
Relógio De Parede Grande Led Digital P/ Academia Hospital,148,(29)
Samsung Galaxy M13 Dual SIM 128 GB cobre 4 GB RAM,1.699,(31)
Camera 3 Antenas Robo Ip Wifi 360º 720p Hd Visão Noturna,139,(124)
"Monitor gamer LG 24MK430H led 23.8 "" preto 100V/240V",1.499,(445)
Kit Para Alongamentos Motor 30.000rpm Unha Gel Alongamentos,429,(58)
Switch TP-Link LS1005G série LiteWave,104,(1073)
"Smart TV Multilaser TL027 LED Full HD 43"" 110V/220V",2.153,(142)
10 Rolos Etiqueta 10x15 100x150 Térmica Serrilha Zebra Elgin,214,(15)
Smart Tv 43'' 4k Uhd Crystal Alexa Built In 43au7700 Samsung,3.099,(143)
Kit 10 Painel Plafon 25w Led Quadrado Sobrepor Branco Frio,329,
Jogo De Soquete Estriado 1/2 Pol 8 A 32mm 22 Pçs Tramontina,261,(3230)
Kit 2 Tenis Masculino Caminhada Academia Promoção + Relogio,139,(28)
Bebê Reborn Baby Boneca Cabelos Castanhos + Enxoval Completo,197,(195)
Impressora a cor multifuncional Canon Pixma G6010 com wifi preta 100V/240V,2.299,(53)
Mesa Para Computador Gamer Madesa 9409 - Preto,429,(1018)
"Smart TV Philips 6800 Series 43PFG6825/78 LED Full HD 43"" 110V/240V",2.799,(246)
Mochila Anti Furto Notebook Saida Cabo Aux Usb Fone Ouvido,76,(207)
"Som automotivo First Option 8850B com USB, bluetooth e leitor de cartão SD",149,(2045)
Kit Gabinete Banheiro - Armário+cuba+espelheira Cross 60cm,419,(65)
Motorola Edge 20 Dual SIM 128 GB preto 8 GB RAM,3.999,(127)
