name,preco,avaliacao
Kit Bota Caterpillar Couro Original Chinelo Carteira Cinto,139,(1128)
Kit 5 Camiseta Manga Longa Masculina Slim Algodão 30.1 Zaroc,149,(1773)
"Smart TV LG AI ThinQ 32LM621CBSB LED 32"" 100V/240V",1.839,(1557)
Refletor Led Holofote 400w Bivolt Prova D'água Branco Frio,175,
Balança Eletrônica Digital Alta Precisão 40kg Bateria Litio,249,(51)
Suplemento em  pó Max Titanium  L-G glutamina em pote de 300g,63,(565)
Kit 12 Cuecas Polo Wear Microfibra Sem Costura Preta Atacado,149,(280)
Geladeira frost free Consul CRM39A inox com freezer 340L 110V,3.469,(224)
"Vídeo Porteiro Com Display 4,3  Ivr 1010 Intelbras Intelbrás",579,(1043)
Kit Whey Protein 2kg + Bcaa + Creatina + Shaker,129,(2589)
Refletor Led 100w Holofote Prova Dágua Ip66 Branco Frio,48,(44)
"Notebook Samsung Chromebook XE310XBA cinza 11.6"", Intel Celeron N4020  4GB de RAM 32GB SSD, Intel UHD Graphics 600 1366x768px Google Chrome",2.999,(402)
Bicicleta Aro 29 Dropp Alumínio Freio A Disco 21 Marchas,1.099,(249)
Moto G31 Dual SIM 128 GB azul 4 GB RAM,2.199,(158)
Tênis Nike Revolution 6 Next Nature Feminino,229,(51)
"Panela De Pressão Tramontina Vancouver 4,5 Lts + 5 Tigelas",269,(2742)
Chuveiro elétrico de parede Lorenzetti Duo Shower Quadra Multitemperaturas branco 7500W 220V,224,(1195)
"Notebook Lenovo IdeaPad 3 prata 15.6"", AMD Ryzen 5 5500U  8GB de RAM 256GB SSD, AMD Radeon RX Vega 7 1920x1080px Linux",4.299,(170)
Console Xbox Series S Microsoft Xbox 512gb Standard Branco,3.499,(1157)
Kit Trilho Eletrificado 2m Preto+ 6 Spots Led 10w Luz Quente,238,(337)
Moto G22 Dual SIM 128 GB iceberg blue 4 GB RAM,1.599,(500)
Sanduicheira Elétrica Fast Grill/sandwich 750w S-12 Mondial,139,(971)
Ar condicionado LG  split inverter  frio 9000 BTU  branco 220V S4-Q09WA5AA,1.904,(44)
Promoção Fio Cabo Flex 750v - 4mm Rl 100mts Cores Marca Sil,368,(21)
"Notebook Acer Aspire 3 A315-56 cinza 15.6"", Intel Core i3 1000G1  4GB de RAM 256GB SSD, Intel UHD Graphics G1 (Ice Lake 32 EU) 1366x768px Windows 11 Home",4.099,(10)
Refletor Led 100w Smd Prova D´água Ip66 Holofote 6500k,57,(1890)
Tênis Feminino Delicate 4 Olympikus,199,(22)
TCL L5 Dual SIM 16 GB preto 1 GB RAM,549,(165)
Aparador De Porta / Rack Para Tv Malbec Retrô Até 55,329,(44)
Pneu Itaro IT101 225/55R18 98 V,568,(39)
Tapete Peludo Pelo Alto Luxo Felpudo 150x200 +brinde,99,(916)
Ar condicionado Consul  split inverter  frio 9000 BTU  branco 220V CBF09EBBCJ,2.173,(201)
350 Envelopes Plásticos Segurança Mercado Livre P 20x32cm*,176,(125)
Tv LG 32 Wi-fi Hdmi Usb Thinqai Inteligência Artificial,1.499,(12)
"Roteador, Sistema Wi-Fi mesh Intelbras Kit Twibi Giga+ branco 100V/240V 2 unidades",688,(416)
Vestido Feminino Crepinho Midi Mullet Babados Decote Cinto,119,(170)
Kit Cftv 6 Câmeras Multi Hd Dvr 8 Canais Intelbras 1108,1.825,
Smart Tv Monitor LG Led 24 Hd Wi-fi Usb Hdmi 24tl520s-ps,1.440,(2598)
Jogo De Soquete 57 Peças 1/4 Catraca Chave Allen C/ Maleta,178,(2237)
"Tapete Para Sala 2,00x2,50 Fácil De Limpar Promoção",144,(981)
Processador Audio Digital Crossover Equaliza Stx2448 Stetsom,336,(7)
Moto Esmeril 6 300w  - Schulz,230,(249)
Smart Tv 32'' Philco Ptv32d10n5skh Led Hd Com Dolby Áudio,1.699,(701)
Purificador De Água Ibbl E-due Placa Prata 127v A 220v,699,(35)
Bota Branca Off White Cano Curto Salto Grosso Bico Fino,99,(654)
Cadeira de escritório Tedge 435882 gamer ergonômica  preta e azul com estofado de couro sintético,1.299,(174)
"Fita Led Neon 5m Alto Brilho Corte 2,5cm Flexivel Siliconada",55,
"Fio Cabo Elétrico Flexível 2,5mm X 100m Colorido Construção",122,(218)
Samsung Galaxy S20 FE 5G Dual SIM 128 GB cloud white 6 GB RAM,3.999,(236)
Kit 5 Refletor Led Smd 100w Holofote Bivolt Ip66 Frio,259,(155)
Disco sólido interno RZX RZXPRO RZX-19SSD6G/240GB 240GB,201,(292)
Chuveiro elétrico de parede Lorenzetti Acqua Ultra Duo branco 7800W 220V,419,(4612)
Kit 2 Radio Walk Talk Comunicador 16 Ch 12km Baofeng 777s Ht,159,(8287)
Fritadeira Air Fryer 4l Afn-40-bi Mondial,459,(13)
Samsung Galaxy S20 FE 5G Dual SIM 128 GB cloud navy 6 GB RAM,3.999,(236)
Kit 50 - Toalhas De Rosto Para Salão - Paris- Promoção,269,(110)
Kit 10 Cuecas Boxer Adulto + 12 Pares Meias Sport Longa,109,(786)
"Pc Computador Cpu Intel Core I5 + Ssd 240gb, 8gb Memória Ram",1.298,(50)
"Maca Preta 3 Posições Estética , Massagem, Tatuador, Micro",895,(20)
Refletor Led 100w Smd Prova D´água Ip66 Holofote 6500k,56,(582)
Blusa De Frio Moletom Jaqueta Slim Masculino Feminino Cores,188,(1576)
Fritadeira elétrica sem óleo Mondial Cozinha AFN-50 5L preta e inox 127V,648,(222)
Bicicleta Spinning Ergométrica Semi Profissional Bike Sport,1.319,(9)
Plafon Painel Led Embutir 60x60 48w Quadrado Frio 6000k 2d,198,(6)
Kit Jogo De Ferramentas 129 Peças + Maleta Sparta,128,(269)
Samsung Galaxy S20 FE 5G Dual SIM 128 GB cloud red 6 GB RAM,2.799,(236)
Kit Travesseiros 50x70 Lavável 6 Unidades Fibra Siliconada,199,(79)
Vade Mecum Rideel - 35ª Edição - 2022/ 2º Semestre,211,
"Monitor gamer Samsung F22T35 led 22 "" dark blue gray 100V/240V",1.065,(17)
Kit 10 Pares Meias Lupo Masculina Soquete Atacado Original,118,(649)
Jogo Panelas Tramontina 12 Peças Antiaderente Alumínio,429,(1816)
Mouse para jogo Tedge  ML-GMH64 preto,108,(49)
"Notebook Multilaser M11W Prime PC280 prateada táctil 11.6"", Intel Celeron N4020  4GB de RAM 64GB SSD, Intel UHD Graphics 600 1366x768px Windows 11 Home",1.488,(52)
Kit Cuecas Box Boxer 10 Peças Original Atacado,99,(4245)
"Smart TV Samsung UN55AU7700GXZD LED 4K 55"" 100V/240V",4.099,(271)
Cama Box Colchão Queen 100% Espuma Dupla Face 158x198cm,1.784,
Torneira de cozinha monocomando Pingoo.Casa Gourmet Munim cromado acabamento cromo,409,(397)
Fire Tv Stick Amazon Controle Remoto Por Voz Com Alexa,300,(24)
Pilha Alcalina Aa Pequena Duracell Com 16 Unidades,74,(458)
Alto-falante LG XBOOM RN9 com bluetooth preto 110V/240V,2.019,(74)
Câmera De Segurança Intelbras Im3 Wi-fi Full Hd 1080p Preta,329,(311)
Samsung Galaxy S20 FE 5G Dual SIM 128 GB cloud orange 6 GB RAM,2.799,(236)
Purificador De Água Com Refil Removível Tedge,99,(27)
Whey Protein Isolado Mix Refil 900g - Profit Labs,76,(705)
Aparelho Adaptador Smart Tv Box Transforme Sua Tv Em Smarttv,249,(26)
Refletor Led 200w Holofote Bivolt Prova Dágua Luz Frio,122,(337)
Bicicleta Aro 29 Krw Alumínio 24 Vel Freio A Disco X42,1.899,(47)
Sala De Jantar Madesa Sheila Mesa Tampo Madeira 4 Cadeiras,729,(53)
"Soprador De Folhas Gasolina Fak260s 2t 26cc 0,90hp",778,(11)
Bota Coturno Feminino Salto Médio Tratorado Macio Promoção,109,(2077)
Jogo Panelas Revest. Cerâmica Cookie Vanilla 8 Pcs Brinox,999,(22)
Bomba periférica Lepono BP60 0.5hp azul 220V,178,(564)
Cristaleira Tifanny Vintage Retrô Pé Palito Off White Imcal,1.237,(26)
Tapete Estampado 150x200 Sala Veludo Luxuoso Aveludado,125,(55524)
"Notebook Acer Aspire 3 A314-35 prata 14"", Intel Celeron N4500  4GB de RAM 500GB HDD, Intel UHD Graphics 60 Hz 1920x1080px Windows 10 Home",1.999,(101)
Streaming Roku Express Full Hd Com Controle Remoto - 3930br,359,(1937)
Microfones JWL U-585 dinâmico  unidirecional preto,640,(1754)
Cadeira De Escritório Presidente Jimmy Healer Preta,562,
Paint Pistola De Pintura Compressor Com Garantia,194,(62)
Smart Tv LG 55'' Lcd 4k Uhd Pro 55up751c Ai Thinq Usb Hdmi,3.399,(81)
Parafusadeira E Furadeira Elétrica 12v Klatter Bivolt,359,
"Painel De Festa 3d 1,50 X 1,50 + Trio Capa Cilindro 3d Veste",199,(12)
"Fritadeira Elétrica Airfry 4,2l 1500w Multilaser Ce19 Preta",379,(19)
Kit 2 Pares De Tenis Masculino Academia Limited + Relogio,139,(729)
Ar condicionado Gree Eco Garden  split inverter  frio 12000 BTU  branco 220V GWC12QC-D3DNB8M,2.634,(158)
"Tapete Sala Peludo Pelo Baixo Luxo 2,00 X 1,50 + Brinde.",131,(55524)
Samsung Galaxy A23 128gb 4gb Ram Branco,1.999,(40)
Geladeira Portátil 40 Litros Digital Quadrivolt12/24/110/220,2.787,(8)
Maca Portatil Maleta Ibiza Altura Regulavel Salus,889,(23)
Fone de ouvido on-ear sem fio JBL Tune 510BT branco,229,(2761)
Impressora Térmica Cupom Elgin Bematech I9 Full Rede E Usb,747,(13)
"Smart TV Semp 43R5500 LED Full HD 43"" 127V/220V",2.599,(98)
Jogo 4 Pneus Itaro Aro 14 It203 185/60r14 82h,1.122,(90)
Fita Led 5050 Rgb Colorida 5mt 16 Cores + Fonte + Controle,65,(614)
Kit 10 Fita Adesiva 500m Larga Transparente Atacado,259,(61)
Jogo De Panelas Tramontina Turim Antiaderente 10 Peças,329,(130)
Samsung Galaxy Galaxy M53 5G Dual SIM 128 GB azul 8 GB RAM,3.499,
Kit 10 Radio Walk Talk Comunicador 16 Ch 12km Baofeng 777s,650,(8287)
"Tablet  Lenovo Tab P11 Plus TB-J616X 11"" 64GB platinum grey e 4GB de memória RAM",1.849,(25)
Lanterna Tática Holofote Tocha Mais Forte Do Mundo Led P90,199,(32)
Creatina Micronizada 100% Pura 300g - Pro Healthy,113,(87)
Liquidificador portátil Oster Super Chef BLSTMG 1.5 L preto com jarra de vidro 127V,249,(906)
Pneu Small Remold 175/70/13 Promoçao Aro  13,700,(26)
Jogo Panelas 14 Pc Teflon Antiaderente Brinde Panela Pressão,429,(133)
Disco rígido interno Western Digital  WD10SPZX 1TB azul,289,(560)
Monitor Concórdia Gamer Curvo Cz270f 27'' Full Hd Hdmi Vga,1.120,
"Smart TV LG AI ThinQ 55NANO75SPA LCD 4K 55"" 100V/240V",3.999,(40)
Cadeira De Escritório Presidente Johnson Travel Max Preta,949,(26)
Jack Daniel's Old No. 7 1 L,167,(593)
Jogo De Panelas 10 Peças Antiaderente Alumínio 1.2mm Cereja,369,(701)
Jaqueta Corta Vento Bmw Blusa Casaco Com/capuz,114,(32)
Kit 200 Máscara Caixa Descartável Tripla C/ Filtro Meltblown,37,(202)
"Smart TV LG AI ThinQ 65UP7750PSB LED 4K 65"" 100V/240V",6.083,(72)
Carabina Espingarda De Pressão Cbc New Jade 5.5+kit Completo,939,(2597)
Bebedouro de água Cadence BEB102 20L branco 127V,449,(684)
Máquina Solda Inversora 230a 220v Alumínio Tig 250g Eletrodo,525,(161)
Central Multimídia Universal 2 Din Mp5 Bt Espelha Dvd,358,(85)
Fogão cooktop elétrica Philco Smart Chef PCT01 preto 220V,499,(629)
Bota Cat Original 100% Couro Legitimo Impermeável +brindes,166,(48)
Kit 4 Cuecas Boxer Lupo Em Algodão Masculina Cotton Original,84,(407)
Fogão  de piso Atlas Mônaco Top Glass  4Q  gás engarrafado 4 queimadores  preto 127V/220V porta com visor 50L,899,(241)
Tênis Masculino Lite Racer 3.0 adidas,299,(115)
Geladeira frost free Consul CRM39A branca com freezer 340L 110V,3.049,(224)
Refil C+3 Filtro Purificador De Água Ibbl. Fr600 Original,53,(630)
Central Multimídia Mp5 1 Din Bluetooth Usb Espelhamento,398,(11)
"Notebook Positivo Motion Q464C cinza 14.1"", Intel Atom Z8350  4GB de RAM 64GB SSD, Intel HD Graphics (Cherry Trail) 1366x768px Windows 10 Home",1.999,(445)
Tapete Sala 300x200  Sisal Quarto Sala Consultorio + Brinde,429,(7972)
Câmera de segurança Intelbras iM4 com resolução de 2MP visão nocturna incluída branca,499,(365)
Kit De 3 Calça Plus Size Jeans Feminina Cintura Alta Cós Alt,199,(475)
Creme Hidratante sem Perfume Cerave Pote 454g,97,(517)
Balança Digital De Precisão Cozinha 10kg Nutrição E Dieta,34,(2538)
"Monitor Philips V 193V5LSB2 led 18.5 "" preto 100V/240V",829,(80)
Balança Digital Corporal Bioimpedancia Aplicativo Bluetooth,78,(73)
Aspirador de pó Wap Clean Speed 1L vermelho e preto 127V,239,(2889)
"Tapete Peludo Felpudo Costa Oro 2,00x2,50 Palha Promoção",178,(55524)
Pneu Michelin Primacy 4 P 205/55R16 91 V,567,(287)
Kit 300 Máscara Caixa Descartável Tripla C/ Filtro Meltblown,49,(109)
Impressora Etiqueta Elgin L42 Pro Usb Zebra Zpl Sigep Envios,1.268,(42)
"Cabo Flexível Sil 1,5mm Rolo 100mts ( Escolha A Cor )",145,(38)
Tênis De Corrida Prophecy 8 Refletivo - 16 Cores Disponiveis,429,
Cadeira infantil para carro Fisher-Price Snugfix 360º preto,1.176,(151)
2 Travesseiros Select Fibras Luxo Importada E Antialérgica,78,(83)
"Bicicleta  urbana GTSM1 Ride New TSI 2022 aro 29 17"" 21v freios de disco mecânico câmbios GTSM1 TSI 3v y GTSM1 TSI 7v cor preto/vermelho",1.249,(1058)
Cuba Inox Gourmet 50 Cm Com Tábua  E Torneira Gourmet Munim,736,(15)
Kit 3 Leggings Mescla Sublimada Não Tem Transparencia Top,119,(472)
Fio Cabo Flexível 10mm 100 Metros Sil Cores,984,(93)
Colcha Casal Queen Matrix 200 Fios Toque Macio 3 Peças,78,(51)
Chuveiro elétrico de parede Lorenzetti Acqua Ultra Duo branco 6800W 220V,375,(4612)
Kit Tenis Infantil De Led Sonic Masculino + Mochila Chinelo,149,(208)
Pc Computador Cpu Core I5 3470 Ssd 240gb + 16gb Memória Ram,2.219,(95)
Whisky Escocês Black Label Johnnie Walker 1 Litro,209,(296)
Máquina Perfect Barber Profissional Dragão Acabamento Barba,99,(402)
Ultra Led 12000 Lumêns - H1 H3 H4 H7 H8 H11 H16 H27 Hb3 Hb4,131,(173)
Moto G20 128 GB verde 4 GB RAM,1.799,(312)
Armário Cozinha Compacta Madesa Emilly Pop Com Balcão Br,799,
Bravecto Antipulgas De 10 A 20kg - Full,187,(12599)
Alto-falante Tedge TK-3612 portátil com bluetooth preto 110V/220V,499,(521)
Pneu Pirelli Chrono C 205/75R16 110 R,944,(11)
Monitor Pcfort Z195 19.5'' Led Vga - Hdmi - Vesa,459,
Central Multimídia 2 Din Mp5 Fiat Palio Siena Câmera Moldura,498,(5)
Torneira de cuba Docol DocolStillo 008202 cor cromo e acabamento polido,569,(75)
Calça Legging Suplex Power Super Lipo Com Elasticidade Lisa,109,(132)
Fritadeira Air Fryer Sem Óleo Naf03i 4l Inox Mondial 110v,689,(143)
Estante Para Livros Livreiro Organizador Multiuso De Madeira,389,(24)
"Fio Elétrico Cabo Flexível 2,5mm Antichama Cobre Rolo 100m",219,(21)
Smartphone Galaxy M52 6.7'' 128gb 6gb Ram Preto Samsung,3.499,(2366)
Modelador Cachos Original Mq Professional Titanium Bivolt,399,(156)
Kit 10 Farol Milha 16 Led 48w 12v/24v Quadrad Off-road 6000k,215,(182)
Repetidor TP-Link TL-WA850RE branco 220V,152,(8940)
Módulo Taramps Ds 1200x4 1200w Rms 2 Ohm Ds1200 Amplificador,769,(390)
Escova Pente Secadora Profissional Seca E Modela Cabelo,49,(37)
Kit 02 Poltronas Decorativa Sala Oferta - Balaqui Decor,339,(121)
Impressora função única Xerox Phaser 3020/BI com wifi branca e azul 110V - 127V,1.199,(179)
Kit 5 Camisetas Masculinas Slim Fit  Básicas Algodão Premium,119,(2191)
Smartphone Motorola Moto G22 128gb 4gb Ram Azul,1.518,(500)
Pilha Alcalina Aaa Palito Duracell Com 16 Unidades,74,(470)
Kit 3 Refletor Led 50w Holofote Bivolt Prova D'água Frio,119,(271)
"Tenis New Luxxor Masculino Academia Caminhada Corrida,",59,(605)
Kit 6 Camiseta Masculina Algodão Confort By Zaroc,139,(580)
Tanque Lavanderia 55 X 45 Com Válvula Aço Inox 201 Tubrax,289,(56)
Patinete Scooter Dobrável Com Led Freio Bv0011 Mega Compras,175,(18)
"Monitor Samsung M5 S24AM506NL LCD 24 "" preto 100V/240V",1.299,(45)
Impressora Não Fiscal Epson Tm-t20 Rede Ethernet Guilhotina,899,(52)
Kit 5 Camisetas Novastreet Dry Fit Anti Suor - Linha Premium,179,(814)
Sanduicheira Master Grill Mondial Inox S-20 110v 60hz,144,(740)
Macaco  Hidráulico Garrafa 10 Toneladas Sparta,199,(16)
"Bomba Submersa Caneta Palito 1/4hp 2,5  Intech Machine Bsca2",618,(296)
"Tablet  Nokia T20 NK069 10.4"" 64GB deep ocean e 4GB de memória RAM",1.699,(9)
"Resina Epoxi Ohana Baixa Viscosidade C/ Endurecedor Kit1,5kg",219,(73)
Válvula Descarga Docol Base Com Acabamento Salvágua Cromado,179,
Tênis Feminino Olimp Para Caminhada Academia Promoção,78,(1776)
Escada de alumínio multifuncional Mor 5206,580,(30)
"*fonte Automotiva Chaveada 13,8 V 90 Amperes + Extensao Cabo",189,(852)
Receptor Midiabox B5 Century Compativel 5g Banda Ku E C.,414,(19)
Kit 4 Banqueta Alta Para Bar/cozinha Promoção Imperdível (c),521,(49)
5 Camiseta Masculina Camisas Slim Voker 100% Algodão Atacado,154,(1019)
Airfryer Fritadeira Elétrica Sem Óleo Multilaser Vermelha 4l,489,(23)
Tenda Gazebo Kala 3x3 Alumínio Dobrável,699,(357)
Kit 10 Calcinha Tradicional Conforto Algodão Elástico Amara,78,(520)
"Smartphone Samsung Galaxy M13 Tela 6,6 128gb 4gb Ram Cobre",1.699,(31)
Jogo Conjunto Mesa Dobrável 70x70 C/4 Cadeiras Madeira,394,(4)
Kit Cftv 6 Câmeras Segurança 1 Mega Dvr Intelbras Mhdx 1108,1.739,
"Parafusadeira Elétrica 4,8v Com 44 Acessórios Klatter Bivolt",159,(4)
4 Camiseta Masculina Camisas Slim Voker 100% Algodão Atacado,139,(108)
Jogo De Brocas Bits E Buchas Com 300 Peças Mtx,50,(445)
Whisky Americano Jack Daniel's Garrafa 1 Litro,167,(575)
Kit 5 Shorts Bermuda Dry Fit Corrida Treino Novastreet,159,(97)
Escova Rotativa Giratória Elétrica De Cabelo Ceramic 1200w,319,(60)
Estufa Manicure Forninho Esterilizador Para Alicate Cutícula,299,(43)
Loção hidratante 473ml Cerave,97,(685)
Puff Maça Com Enchimento + Apoio De Pés Couro Sintético Novo,179,
Rack Com Painel Tv 65 Polegadas Madesa Miami 1 Porta - Preto,499,(35)
Totoka Plus P/ Menino Bebê Infantil Carrinho Motoca Velotrol,148,(35)
Fone de ouvido on-ear sem fio JBL Tune 510BT azul,229,(2761)
Papel Adesivo Vinílico Moveis Geladeira Várias Cores 2mx80cm,57,(97)
Máquina de lavar automática Brastemp BWJ09A branca 9kg 127 V,2.499,(177)
Modulo Taramps Ts 800x4 Novo Ds800x4 800w Rms 4 Canais 2 Ohm,587,(1666)
Cadeira Máximo Gamer Preta E Azul Reclinação 155º,1.610,(93)
No break Ts Shara UPS Mini 600 600VA saída de 115V com entrada de 115V/220V CA preto,509,(302)
Barraca De Camping Iglu Para 2 Pessoas Azul Klatter,199,(30)
"Tablet  Multilaser M8 Wifi 8"" 32GB preto e 2GB de memória RAM",799,(53)
Relógio Champion Feminino Dourado Prova D´água Original,259,(747)
"Fio Cabo Flexível 6,0mm 100 Metros Sil Diversas Cores",521,(4)
Luminária Solar Refletor Poste 100w Potente Led 12h Oversun,149,(362)
Cama Elástica Pula Pula Para Locador Reforçada,1.499,(6)
Celular Do Idoso Com Internet E Whatsapp Sos 32gb Ob023,786,(16)
Kit 3 Pares Meias Lupo Cano Longo Masculina Atacado Original,55,(39)
Trio Capa Cilindro + Painel Temas De Festas Veste Fácil,179,(24)
Kit Cuba Pia Aço Inox Gourmet Carajás Cozinha E Acessórios,290,(20)
Buffet Aparador Off White Balcão Sala Jantar Estar Retrô,639,(619)
Poltrona +reforçada Cadeira Escritório Recepção Balaquidecor,257,(18)
Power Inversor Tensão 12v 220v 2000w Transformador - C/usb,299,(9)
Kit 3 Carrinhos Plástico Ecoflex P/ Compras Duplo Cesto 25 L,2.049,
Tênis Nike Revolution 6 Next Nature Masculino,389,(275)
Luminária de emergência Intelbras LEA 150 LED 1 W 100V/240V branca,29,(517)
Receptor Digital Century Midiabox B4 Azul Hd Tv Midia Box B4,419,(340)
Jogo De Taças Para Vinho Classic 300ml 6 Peças - Casambiente,103,
Torneira Metal Inox Filtro Gourmet Pia Mesa Cozinha Bancada,149,(1091)
Máquina de solda inverter Super Tork Profissional KAB 150 Micro amarela e preta 50Hz/60Hz 220V,521,(240)
Cama Carro Infantil Vermelha C/ Colchão Grátis Frete Gratis,592,(27)
TCL L10 Lite Dual SIM 64 GB power grey 2 GB RAM,1.199,(301)
Kit 2 Chuveiro Ducha Fria Redondo Acqua Plus Cromada Deca,1.149,
Impressora Termica Cupom 80mm Bematech I9 Full Rede Usb,749,
Kit Upgrade Gamer - Intel Core I5 3.4ghz + H61 + 8gb De Ram,1.299,(8)
Maquina De Cabeleireiro Profissional Sem Fio Barber Shop Top,124,(165)
Placa de vídeo Nvidia Galax  GeForce GTX 16 Series GTX 1660 Ti 60IRL7DSY91C 6GB,2.799,(46)
Teclado Roland Revas Kb330 Kb-330 61 Teclas Sensitivas + Kit,1.798,(8)
Impressora Térmica Epson Tm-t20x Usb/serial Nao Fiscal,699,(32)
Tenis Sport Titanium  Original - Esportivo,89,(374)
Monitor Pcfort Z195 19.5'' Led Vga - Hdmi - Vesa,479,
Samsung Galaxy S21 FE 5G 128 GB branco 6 GB RAM,3.334,(96)
Teclado musical Yamaha PSR Series PSR-E373 61 teclas preto,2.049,(68)
Kit 8 Câmeras Intelbras Full Hd 1220b Dvr 8 Canais Com Hd,2.390,
Kit 2 Pares Tenis All Black Star Hike Run Feminino Plataform,139,(49)
Nicho Para Banheiro E Cozinha Parede Embutir 30x60 Metasul,128,(86)
Smart Tv 50'' 4k Uhd Android Tv 50pug7406 Philips,3.699,(109)
Capa Tática Modular Tatico Da Comanfy Geração 5,535,(4)
Ralo Linear 6x50cm Invisível Sifonado Oculto Cola Piso Preto,58,(19)
Jogo De Panelas Tramontina Allegra 2pç Aço Fundo Triplo Full,299,(87)
Carrinho De Bebê Galzerano 1016 Milano Reversível,859,(16)
Tênis Gamecourt 2.0 adidas,499,(24)
Kit 10 Luminária Tubular Led Slim Branco Frio 120cm 40w,299,(58)
Smartphone Samsung Galaxy A13 4g 128gb 6.6 50mp E 8mp Branco,1.589,
Furadeira Industrial Impacto Rev 450w Gsb 450 Re Bosch + Kit,369,(248)
Cozinha Completa Madesa Reims 310001 Com Armário E Balcão,1.998,(51)
Kit Cftv 6 Câmeras Segurança Hdcvi Dvr Intelbras Mhdx 1108,1.814,(7)
Pneu Itaro IT301 215/45R17 91 W,431,(18)
"Cortina Sala Quarto Corta Luz 100% Blackout 2,80x2,30 Cores",154,(832)
Climatizador Ambientes Ind. E Residencial Cli70 Sj Ventisol,1.799,(6)
Máquina Solda Inversora 190 Eletrodo E Tig Lift + Acessórios,420,
Purificador De Água Ibbl E-due Placa Branco 127v A 220v,629,(105)
"Notebook Lenovo IdeaPad 3i prata 15.6"", Intel Core i5 10210U  8GB de RAM 256GB SSD, Intel UHD Graphics 620 1366x768px Windows 11 Home",4.399,(175)
Smartphone Samsung Galaxy A23 128gb 4gb Ram Tela 6.6  Preto,1.715,
Pneu 175/65r14 Dunlop Sp Toring R1   82t - Kit 4 Unidades,1.857,(12)
Liquidificador Mondial Turbo Inox L-1100 3 L vermelho e inox com jarra de san 127V,199,(2003)
Azulejo 20x20 Bebidas Vintage Área Bar Restaurante Cozinha,155,
Tênis Feminino Advantage End Plastic Branco adidas,299,(114)
Calça Em Oxford De Elástico 4 Bolsos Uniforme Para Trabalho,36,(152)
Smartphone Galaxy A03 Tela 6.5'' 64gb 4gb Ram Azul Samsung,1.299,(1344)
"Monitor gamer LG UltraGear 24GN600 led 24 "" preto 100V/240V",1.919,(254)
Mochila Maternidade Lequeen Original Moda Grande Reforçada,199,(114)
"Notebook Asus VivoBook X543UA cinza-oscura 15.6"", Intel Core i3 7020U  4GB de RAM 256GB SSD, Intel HD Graphics 620 1366x768px Windows 10 Home",3.499,(202)
"Ombrelone Central Redondo 2,40 Metros Solasol Sungap",399,(26)
Pipoqueira elétrica Agratto Pop Cine ar quente vermelho 1200W 220V,152,(369)
Chinelo Masculino Kenner Full Force Promocao Exclusiva,109,(8)
Bota Botina De Seguranca Masculino Trabalho Bic Pvc Fujiwara,69,(14)
Placa de vídeo Nvidia Galax  GeForce RTX 30 Series RTX 3060 Ti 36ISL6MD1VQW 8GB,4.999,(8)
Conversor Smart Tv Box 4gb De Ram 64gb Pro 4k - Android 10,169,(36)
Vídeo Porteiro Interfone Eletronico Camera Intelbras Ivr1010,649,(1043)
Kit 5 Barras Rodapé Poliestireno 10 Cm Frisado Branco Preto,279,(18)
Carrinho Infantil Passeio Criança Com Haste Direcional,359,(11)
Kit 2 Pares Tenis Feminino Old School Tradicional Classico,129,(374)
Painel Plafon 25w Quadrado Sobrepor Super Led Luz Forte,49,(1189)
Aparelho De Fondue Com 11 Peças Serve 6 Pessoas Tedge,191,(4)
Forno de bancada elétrico Philco PFE60I 60L prateado 127V,736,(82)
Relógio Technos Masculino Original Garantia Nfe,599,(131)
Kit 5 Camiseta Regata Masculina Atacado Blusa Camisa,124,(48)
Mesa De Canto Pé Palito 2 Mesas Tripe Redonda Fosca ***,157,(73)
Micro-ondas Brastemp BMS46AR   cinza 32L 220V,1.189,(4)
Kit 10 Pares Meia Lupo Soquete Cano Curto Masculina Algodão,129,(874)
Botina De Segurança Bota Modelo Baf Nobuck Bico Pvc Bracol,179,(972)
Kit Fácil Falante Hurricane 6 + 6x9 280w Rms Prático Som,189,(67)
"Balança corporal digital de banheiro Importway IWBDBIO-001APP, até 180 kg",104,(250)
Cadeira Escritório Giratória 360º Total Preta Reclinável 155,1.399,(97)
Alto-falante Tedge TK-86 portátil com bluetooth preto 110V/220V,255,(1834)
Babá Eletrônica Câmera Sem Fio Visão Noturna Lcd Digital 2p,355,(17)
"Notebook Lenovo IdeaPad 3i prata 15.6"", Intel Celeron N4020  4GB de RAM 128GB SSD, Intel UHD Graphics 600 1366x768px Windows 11 Home",2.299,(175)
"Bateria Selada 12v 18ah Rbc7, Rbc11 E Rbc55 No-break Moura",320,
Bomba Pressurizador De Água Quente E Frio 120w Intech,339,(68)
Oxímetro de pulso para  dedo G-Tech OXIOLCM roxo,169,(5753)
Sala De Jantar Madesa Aline Mesa Tampo De Vidro 4 Cadeiras,799,(33)
Bicicleta Aro 29 Dropp Z3 Câmbio Shimano 21 Vel Freio Discos,1.449,(594)
Balança Portatil Digital Mão Mala Bagagem Pesca Até 50 Kg,31,(102)
Manta Asfáltica Auto Adesiva Aluminizada - 30cm X 10m,54,(199)
Colchão Inflável Casal Com Inflador Acoplado Multiuso - Mor,173,(5)
Kit Conjunto Bags Feminina Promoção De Fabrica Willibags,189,(204)
Fogão  de piso Consul  CFO4NAB  gás engarrafado 4 queimadores  branco 127V/220V porta com visor 58L,1.109,(334)
Carregador De Bateria Automotivo 50a 12v + Auxiliar Partida,759,
"Kit 4 Sapatenis + Carteira, Cinto E Relógio De Brinde",199,(225)
Aspirador de pó Electrolux Power Speed Plus STK14 1.6L denim blue 127V,309,(490)
Maquina Multiprocesso Mig/tig/eletrodo 140amp Wwsoldas,1.199,(106)
Fonte Carregador Stetsom 200a Display Digital,729,
"Smart TV Samsung UN40T5300AGXZD LED Full HD 40"" 100V/240V",2.099,(329)
Smartwatch W27 Pro Series 7 Lançamento 2022 Chamadas Nfc,209,(479)
Compressor de ar elétrico portátil Tekna CP8550C monofásica amarelo 127V 60Hz,1.340,(336)
10 Fitas Adesivas Largas Transparentes 500m Embalar Durex Ps,229,(9)
Smartphone Motorola Moto G22 128gb 4gb Ram Azul,1.599,(500)
Cadeira De Escritório Preta Diretor Bob Travel Max,514,(9)
Par Pneu Aro 29x2.10 Faixa Bege 54-622mm Paco Nomad+ Câmaras,159,(73)
Refletor Led Holofote 300w Ip66 Bivolt Forte Luz Branco Frio,179,(4)
Fritadeira Elétrica Multilaser Air Fryer 4 Litros 1500w 110v,499,(172)
Controle Longa Distancia Stetsom Sx2 Light Completo Colorido,62,(1583)
Calça Jeans Feminina Wide Leg  Destroyed Modelada Lançamento,78,(71)
Plotter Hp T250 C/ Wifi Bivolt - Substituto Do Plotter T130,4.229,
Kit 6 Conjuntos Soutien Sutiã Calcinha Liso Cores Sortidas,119,(1837)
Piscina estrutural retangular Botafogo PIS0627 com capacidade de 400 litros de 1.15m de comprimento x 1.06m de largura  azul,155,(367)
Monitor Gamer Shin Kai 24 Pol Warrior - Mn103,1.159,(11)
Forno de bancada elétrico Oster OFOR455 45L grafite 127V,1.099,
Rodapé Eva Flexível Autocolante 5cm - Rolo 10 Metros +brinde,159,(14)
Combo Duplo Whey Protein + 2x Bcaa + 2x Creatina + Shaker,229,(566)
Capa Chuva Roupa Conjunto Motoqueiro Impermeável Pioneira,99,
Forno de bancada elétrico Oster OFOR455 45L grafite 220V,1.099,
Nível laser cruz Bosch GCL 2-15 15m,997,(360)
"Monitor Concórdia Gamer R200s 23.8 Full Hd, 165hz, Freesync",1.038,(4)
7 Lixa Diamantada Polir Granito Porcelanato Concreto Suporte,124,(94)
Carregador Rápido Para Mac&iPad Anker 735 Nano Ii 65w,261,
